Skin Type,Usage Periode,Review,Rating,Label
"Combination, Medium, Warm",Usage Period : More than 1 yearPurchase Point : Shopee,sih hulk somethinc level retinol produk retinol coba pakai retinol bulan retinol untuk usia usia pasuk fase ageing retinol tuju lambat proses penuaaan kulit muda sih kulit awet muda  tahu retinol bahan aktif lumayan takut orang coba malas purging malas ngatasin breakoutnya basic skincare pada mereapply sunscreen kali hari coba retinol ya purging breakout nama emergency skincare panik buat purging breakout retinol somethinc kemas botol kaca warna hijau aplikator pipet serum isi ml turut pakai tetes tekstur cair minyak cepat banget nyerap kulit aroma suka hidung aroma kayak buah belimbing segar pakai retinol step serum kali minggu tekstur cair lengket mudah banget dispread pakenya kering serum kandung ingredients hidrasi glycerin ceramide hyaluronic acid allantoin hasil kagum pakai kulit sehat cerah bulan pakai notice poriporiku samar bersih good job maintenance jerawat aktif retinol andal buat calm radang efek samar noda hitam notice turut bekas jerawat susah samar bekas jerawat samar botol habis,5,Positive
"Combination, Medium Light, Neutral",Usage Period : 6 months - 1 yearPurchase Point : Shopee,beli produk orangorang bagus buat kayak ya kayak ubah nyaman pakai lembap lebay bau rutin pakai keliahatan hasil ya,4,Positive
"Dry, Medium Light, Warm",Usage Period : 3 months - 6 monthsPurchase Point : Shopee,kali coba retinol bantu nyamarin kerut jatuh sih somethinc harga oke turut banding serum retinol lain warna nya putih bening ya kuning tekstur super watery habis pakai muka auto alus banget lembab ngefek jujur tau produk somethinc pakai enak banget muka efek kulit aku sedihhh bagus ya love products coba rangkai tapi badak nih kulit coba retinol coba somethinc jangkau turut kaleng,5,Positive
"Combination, Dark, Warm",Usage Period : 3 months - 6 monthsPurchase Point : Shopee,kali coba retinol pengin hilang smile les kerut mata pakai malam pagi muka alus bikin bruntus jidat efek anti aging pakai,4,Positive
"Oily, Medium, Warm",Usage Period : 1 month - 3 monthsPurchase Point : Shopee,cerahin kulit bagus banget sih dia cocok kali pakai retinol kali ya biasa pakai kurang kali minggu bikin bruntusan jidat jual nih isi ribu domisili kalimantan thnks tau coba beli full,4,Positive
"Dry, Medium Light, Warm",Usage Period : Less than 1 weekPurchase Point : Shopee,retinol suka sih hasil pakai minggu tambah sih hylarunic nya somethinc kinclong pakai minggu kali rutin tekstur cair bikin susah turut bagus,4,Positive
"Oily, Medium, Neutral",Usage Period : 1 month - 3 monthsPurchase Point : Shopee,tekstur cair banget kayak toner bagus banget ubah kulit notice pakai product jarang jerawat dahi jerawat kecilkecil buah mah cinta banget,5,Positive
"Oily, Medium Light, Neutral",Usage Period : 1 month - 3 monthsPurchase Point : Shopee,retinol aman pakai kulit wajah timbul efek negatif breakout jerawat tekstur cair mudah resap kulit layer serum niacinamide aman pengaruh kulit wajah,5,Positive
"Dry, Light, Cool",Usage Period : 1 month - 3 monthsPurchase Point : Shopee,coba produk retinol kaya jaman pakai erha kandung retinoid retinol kalo somethinc tau efek muka atur pakenya ya produk kali minggu ya cmiiw bikin kulit muka sensitif siang hari malas pakenya coba habisin produk botol kalo efek bagus update reviewnya repurchase  produk somethinc bikin breakout sih muka ku update suka pakai area leher tau double chin baik kulit leher kencang topang lemak leherdagu wkwkwkk,4,Positive
"Oily, Medium Dark, Warm",Usage Period : 1 week - 1 monthPurchase Point : Shopee,gue pakai retinol sok first time ever gue langsung jatuh cinta retinolnya sih somethinc fix sih gue repurchase berkalikali haha scroll tiktok konten retinol saran pakai retinol lo masuk umur sok soon hit langsung gue beli jujur gue penasaran brand somethinc hype banget gue cari tau gue bingung jenis serum buanyak banget gue ajar tuh baru gue beli sih retinol gue pakai malam layer niacinamidenya pakai niacinamide deh retinol pagi pas bangun tidur gue langsung muka bagus bekas jerawat mudar muka cerah tekstur muka mulus gradakan guys kayak aspal efek anti agingnya sih tau ya keriput  oh iya pakai retinol lupa pakai moisturizer ya retinol layer aha bha salicylic acid benzoyl peroxide lupa pagi pakai sunscreen ya cantik ,5,Positive
"Combination, Medium Light, Cool",Usage Period : Less than 1 weekPurchase Point : Official Brand Store,enak bikin cekit efek apa kulit enak banget layer pakai malam efek kelupas bikin kulit smooth jarang jarang pakai nya layer skin care ok mula coba retino bikin mulus kulit,4,Positive
"Combination, Light, Neutral",Usage Period : 3 months - 6 monthsPurchase Point : Beautyhaulindo,ure suffering pihpie plis coba breakout parah bekas campur pih pie anddd serum works amazingly bothwaysss maju mundur ingredients retinol gacocok usia dermatologists n experts saran avoid retinol hit luckily dermatologists says okay pas pakai langsung jatuh cinta banget ajaaib semalem langsung smoothing bekas jerawat tekstur baik banget pake banget kaget haru ku ikhlas kalo kulit mulus kayak asih cercah harap cercah bong kulit gue bekas jerawat pakai ngelak kalo bantu treatment dokter plis gue pastiin banget kalo plays major part skin improvements tekstur cair banget suka dripping kalo ditetesin muka cepat nyerepnya pakai build jeda minggu minggu minggu kali maintain minggu kali pakai kulit gue oke sayang skin never better im using undeniable too beli deh,5,Positive
"Combination, Medium, Warm",Usage Period : 1 month - 3 monthsPurchase Point : Tokopedia,orang kali pakai serum retinol cocok berani coba suka banget banget parah pakai efek negatif apa kulit wajah kering kadang bruntusan banget hydratingnya kudu dikencengin layak pakai zat aktif hasil kulit cerah banding pakai peeling aha bha garis halus hilang pudar warna kulit rata jerawat haid komedo pakai peeling apa harga jangkau hasil bagus suami notice banget sayang banget produk gampaaang banget oksidasi minggu kuning hasil bagus kemas tekstur semi lotion warna putih botol solid transparan paonya ubah simpan kulkas ribet sih ya,5,Positive
"Combination, Medium, Warm",Usage Period : 3 months - 6 monthsPurchase Point : Tokopedia,tau habis pakai muka terbit jerawat pms pakai minggu sekali pakai jerawat habis pakai bikin muka halus efek jerawat bikin malas sisa pakai leher biar aman,2,Negative
"Normal, Medium Light, Neutral",Usage Period : 1 week - 1 monthPurchase Point : Shopee,cerita umur concern bekas jerawat merah coklat jerawat hormonal maju mundur pakai bagus banget kulit bekas jerawat pudar jerawat hormonalnya kurang retinol somethinc masuk kategori encapsulate retinol gentle aman pakai cekit pakenya aman bikin kulit kering pakai hydrating tonerretinol somethincniacinamide somethinc pakai juara,5,Positive
"Combination, Medium, Neutral",Usage Period : 1 month - 3 monthsPurchase Point : Lazada,iseng pakai beli paket hyalu niacin moisture beet produk punya buka warna kuning pakai minggu minggu biasa retinol bahan pakai retinol enkapsulasi buat retinol somethinc keras berlayerlayer pelembab pakai efek timbul ngeri banget ok jerawat cepat kering poripori kecil proses regenerasi kulit cepat habis basuh muka pakai air langsung kulit akan kikis muka putihputih duga asal kulit mati ganti stimulasi sih retinol kayak aku serba salah cuci muka takut ambil wudhu takut moisturizer kandung ceramide muka sensitif banget cahaya matahari kulit gampang timbul alergi untung nemu trik pakai amanaman pakai minggu pakai cinta banget retinol sayang timbul segi produk oksidasi punya warna cokelat banget pakai sih jelas somethinc ubah warna aman,5,Positive
"Oily, Medium, Neutral",Usage Period : 1 month - 3 monthsPurchase Point : Shopee,bagus bikin muka jarang jerawat jrwt bo prodk bantu nyembuhin banget pakai produk kandung tretinoinvitacid bikin mulus bikin muka ngelupas jelek banget yaudah cari alternatif ganti ketemu retinol somethinc bikin muka perih ngelupasnya ganggu samsek benar suka updated retinol somethinc baru ganti tekstur kaya kayak bening air kentel putih serap bagus bikin purging ngelupas parah,5,Positive
"Combination, Medium, Neutral",Usage Period : 3 months - 6 monthsPurchase Point : Shopee,retinol coba kondisi muka bo cocok niacinamide minggu pakai jeda ngempesin jerawat bo alhamdulillah pakai rasai purging aga nampol kalo pakai serum single layer serum kalo layer pakai alpha arbutinnya avoskin maut bantu nyamarin bekas jerawat pie ,5,Positive
"Normal, Light, Neutral",Usage Period : 1 month - 3 monthsPurchase Point : Shopee,bagus banget sumpah wajah tuh halussss banget parah jerawat cepat kering komedo hilang gabung bakuchiolnya somethinc pokok suka banget banget nyetok sih product andal banget,5,Positive
"Oily, Light, Neutral",Usage Period : 1 month - 3 monthsPurchase Point : Shopee,pakai fss retinol suka banget efek retinol somethinc produk kecewa putus coba produk testurnya ringan banget mudah aplikasi efek produk mudah banget oksidasi produk mild banget kali coba retinol produk banget coba,4,Positive
"Combination, Medium Light, Warm",Usage Period : 1 month - 3 monthsPurchase Point : Shopee,orangorang cocok produk stop pakai wkwk efek negatif apa pakai tapiiii warna produk kuning gumpal kuning hubungin cs ganti tapiiiiiii ujungujungnya mengungin gumpal simpan kulkas sinar matahari huhu sedih sih pakai retinol oh iya pakenya kemas kotak ya bulat kayak,3,Neutral
"Combination, Medium Dark, Warm",Usage Period : 1 month - 3 monthsPurchase Point : Shopee,coba retinol nya somethinc kali coba retinol mild banget nimbulin efek aneh sok good sign tekstur cair cepat banget menyerapny drying habis pakai langsung timpa pakai facial oil pakenya layer serum kulit badak ngaruh samsek pih jerawattapi ngaruh banget pori kaget bangun kayak pori repurchase sih,4,Positive
"Combination, Medium, Neutral",Usage Period : 3 months - 6 monthsPurchase Point : Shopee,rekomended banget sesal pakai somethinc retinol cocok banget muka cuman lengket nyerepnya cepat banget bikin muka bekas jerawat mudar gabung niacinimade cocok,5,Positive
"Combination, Light, Cool",Usage Period : More than 1 yearPurchase Point : Instagram,btw gue pakai leher  biar nyamarin kerut leher auto kerut leher kurang parah banget tekstur cair kayak warna kuning coklat packaging suka kaca trz pendek nyaman bawa kmn gede banget  lp leher tambah moisture  biar kering,5,Positive
"Combination, Medium Light, Neutral",Usage Period : 3 months - 6 monthsPurchase Point : Shopee,kaya lovehate relationship somethinc cocok cocok banget produk retinolnya salah cocok pakai pakai hasil banget tekstur kulit wajah kasar tau kayak komedo putih mendem tuh maksud agam pricey turut ya repurchase lol,4,Positive
"Oily, Medium, Warm",Usage Period : 3 months - 6 monthsPurchase Point : Shopee,first retinol quite gentle mild progres slow sure mildgentle banget progres skin texture pih pie ok banget prevent hormonal acne kalo layering bareng niacinamidenya skingame theory everything tekturnya juara retinol serum tering coba watery absorbs perfectly bau chemical still okay id highly recommend wants try retinol first time good start beginner,5,Positive
"Dry, Medium, Neutral",Usage Period : Less than 1 weekPurchase Point : Shopee,tekstur cair gerah cepat nyerep ku pakai retinol nya habis lihat review bagus beauty vlogger teman sok far kulit ku jerawat mateng masker kempes pakai semalem aga amazing sih we ll sih botol habis rekomen course,5,Positive
"Oily, Medium, Neutral",Usage Period : 1 month - 3 monthsPurchase Point : Shopee,pakai habis botol ubah sih jerawat baik banget cerah sih bareng pakai niacinamide ngefek banget jerawat baik cocok sih pakai coba serum retinol,4,Positive
"Oily, Medium, Warm",Usage Period : 3 months - 6 monthsPurchase Point : JD.id,tekstur air toner nyerapnya cepat sih efeknyaa nampol banget besok muka haluss tekstur baik jerawat gampang kempes bruntusan hilang minyak kontrol sangka banget  somethinc reformulate ya suka ,5,Positive
"Combination, Medium Light, Cool",Usage Period : 3 months - 6 monthsPurchase Point : Shopee,retinol aman kulit sensitif harga jangkau nyaman pakai kali minggu kali minggu pengin pakai banget habis pakai malam pagi kulit bagus,5,Positive
"Combination, Medium Light, Neutral",Usage Period : 1 month - 3 monthsPurchase Point : Shopee,retinol pake turut cocok mula pakai kulit minggu munculin jerawat yes kulit kering banget tambah serum hyaluronic acidnya bulan stop pakai serum ini texture serum lumayan ubah warna serum cepat oksidasi,3,Neutral
"Normal, Medium, Warm",Usage Period : 1 week - 1 monthPurchase Point : Shopee,banget kulit sehatapalagi henti cream etiket biru jual bebas klinjk cantik kulit wajah bruntusan berteksture minggu pakai kali hasil ingat busui henti,5,Positive
"Combination, Medium, Neutral",Usage Period : 1 month - 3 monthsPurchase Point : Official Brand Store,update jatuh cinta retinolnya somethinc bantu banget sembuh breakout kunyobain versi baru sih level encapsulated retinol bulan pakai minggu kali sok far sok good galau granactive snow encapsulated pure retinol jujur takut pas awalawal coba kulit suka sensy produk reformula alhamdulillah cocokcocok pakai purging dikit dahi pipi jerawat kecilkecil lekas kering hilang rasa banget beda ya habis retinolan pagi kulit plumpy glowing bersih poriporinya suka tekstur tekstur tekstur emulsion ringancair nyaman muka bau sih banding bekas jerawat pudar bekas jerawat love retinol sok much,5,Positive
"Normal, Medium Light, Neutral",Usage Period : More than 1 yearPurchase Point : Beautyhaulindo,first retinol beli pas kali somethinc launch ku pakai masuk usia usaha maintain kit tanda tua kulit tekstur encer fast absorb pakai malam hindar layering vitamin sih takut reaktif hasil,5,Positive
"Combination, Medium, Neutral",Usage Period : 6 months - 1 yearPurchase Point : Gift,bagus banget sih pokok texturenya tuh cair kocok pakai cepettt banget nyerap kulit kayak hyaluronic bnya kalo malam pakai besok pagi muka rasa alusss banget problem bau kayak tape hahaha buat ganggu sih kuat tekstur bau niacinamidenya,5,Positive
"Combination, Medium Light, Neutral",Usage Period : 1 month - 3 monthsPurchase Point : Beauty Studio,maju mundur coba retinol beli paket holiday kayak paham pakai retinol lho haha pas coba pakai muka kering bagus haha trauma pakai,2,Negative
",25 - 29",Usage Period : 6 months - 1 yearPurchase Point : Shopee,gunain retinol somethinc bulan habis botol coba retinol bentuk cream rani coba produk aman kulit sensitif gunain minggu kali hasil tekstur kulit baik tau jerawat hilang timbul wajah sensitif produk bagus digunain kali minggu,3,Neutral
"Dry, Medium Light, Warm",Usage Period : 3 months - 6 monthsPurchase Point : Shopee,retinol pertama pakai minggu khawatir kulit ku nagih retinol  sok far keluh guna minggu aging jaga atur keriput fine line tahan muncul ,5,Positive
"Combination, Medium Light, Neutral",Usage Period : 3 months - 6 monthsPurchase Point : Beauty Studio,salah product ampuh banget buah pih ku susah banget ilangnya pas nyobaiin minggu kaget banget langsung hilang pih ku upload twitter ku naaazzzs pakai nya kali minggu,5,Positive
"Combination, Light, Cool",Usage Period : Less than 1 weekPurchase Point : Shopee,varian pakai retinol coba pakai somethinc retinol easy use mudah ubah warna klaim fungsi ubah warna pakai purging bulan baik muncul pakai malam pagi merah kurang jerawat calm tahap purging edit review edit var stabil warna putih thick enak pakai bikin iritasi efek lumayan ngaruh bagun tidur muka cerah jerawat hormonal parah muncul suka var,4,Positive
"Combination, Medium, Neutral",Usage Period : 1 week - 1 monthPurchase Point : Tokopedia,luvvv banget hilang bruntusan jidat serum retinol gue coba mild gue gabung serum tonernya avoskin retinol tekstur tuh cair banget kayak toner gue bingung gue aplikasi duluan avoskin kental toner haha gue serum tuh sulit baur gampang serap pakai langsung gue dot dot wajah pakai tingling sih gue serum lumayan bikin lembab kandung ceramide hyalurnonic acid sumpah gue tekstur jidat gue tuh pelan hilang semenjak pakai retinol combo toner retinol kayak repurchase nih harga jangkau banget manjur kulit gue lumayan badak plis somethinc keluar retinol botol gede ha niacinamide botol gede,5,Positive
"Dry, Medium Light, Warm",Usage Period : 3 months - 6 monthsPurchase Point : Beautyhaulindo,using since sept kondisi kulit kering sok ngefek garis garis halus file line pakai rutin sih ngerasanya garis halus pudar ngerasanya retinol bantu pudar bekas jerawat proses pematang jerawat tekstur cair banget mudah banget resap oiya pakai kondisi wajah kering kering efek tingling guys sok far suka sih,4,Positive
"Combination, Medium Light, Neutral",Usage Period : More than 1 yearPurchase Point : Shopee,kali coba retinol kali coba serum somethinc tekstur cair warna oren bau lumayan sengat hasil gentle cepat banget mudarin noda hitam bekas jerawat bikin kulit kenyal bikin kulit kering kelupas kalo makenya sering,5,Positive
"Dry, Medium, Neutral",Usage Period : 3 months - 6 monthsPurchase Point : Brand website,newbie guna retinol telat banget sih umur pakai retinol  produk mild salah pakai pakai langsung bikin purging alhamdulillah stop minggu muka lanjut pakai pakai sensasi cekit bakar dkk dll bantu pudar fine les mata  suka combine niacinamide besok pagi muka plump licin banget tekstur cair ati apply muka ya bau sengat aman newbie sih oiya pakai kali minggu biar cepat habis wkwk,4,Positive
"Oily, Medium, Neutral",Usage Period : 3 months - 6 monthsPurchase Point : Shopee,suka banget serum somethinc cocok banget kulit pakai minggu kali pas malam besok wajah bersih kencang pas banget sih pakai wajah breakout oke tekstur cair retinol bau bau chemical ya simpan kulkas pakai sensai dingin suka banget,5,Positive
"Oily, Medium Light, Cool",Usage Period : 1 week - 1 monthPurchase Point : Shopee,tarik coba serum reviewnya bagus hype kalang perbeautyan coba produk breakout wajah kunjung sembuh pemakain rutin ubah signifikan kondisi kulit improve sok product,2,Negative
"Oily, Light, Warm",Usage Period : 3 months - 6 monthsPurchase Point : Shopee,update review ngabisin serum suka hasil tuh beli ragu kali giur retinol merk repurchase jerawat tahun saran level retinol apa merknya coba gaes,5,Positive
"Combination, Medium, Neutral",Usage Period : 1 month - 3 monthsPurchase Point : Brand website,somenthinc play play usia mid si banget pakai retinol penasaran cobainlah sih retinol super cinta banget kandung kulit kombi kering result kulit kalo full minggu pakai kulit halus supple kalo jerawat bantu banget cepat kurang adang jerawat pakenya pakai kalo butuh tenaga extra jaga kulit kebal kalo butuh banget pakai,5,Positive
"Combination, Medium, Warm",Usage Period : 3 months - 6 monthsPurchase Point : Shopee,maju mundur pengin coba sih retinol eh pakai luv botol habis rasai kulit putih bersih tambah niacinamide ya axis booster efek kulit wajah putih ya seram sih kalo belang tangan  seling pakenya deh enak henti pakai hamil sedih banget pakai orang hamil,5,Positive
"Normal, Medium Dark, Neutral",Usage Period : 3 months - 6 monthsPurchase Point : AEON,pakai retinol kosong botol review sok far enak pakai purging bikin kering tekstur cair spot hitam pudar smile les pudar bau kayak obat sih ya probs sih repurchase coba retinol,4,Positive
"Dry, Light, Cool",Usage Period : 1 week - 1 monthPurchase Point : Shopee,hi edit review pakai levelup encapsulated retinol versi baru notice kali tekstur warna ubah serum retinol serum warna putih tekstur emulsion serum bau pakai gampang serap kasih efek lengket coba serum minggu rasai serum mild kulit kulit supple skin textureku halus  update pakai bulan ya ,5,Positive
"Dry, Medium, Warm",Usage Period : 3 months - 6 monthsPurchase Point : Tokopedia,retinol coba warna kuning tekstur cair pakai malam minggu kali bagi orang kencang efek samping coba malam jujur rasa ubah apaapa pakai retinol bikin breakout jerawat aga radang efek apaapa pakai step tambah serum vitamin sih lumayan ubah kulit kebal apaapa hehe rekomendasi mula pakai retinol bintang,3,Neutral
"Combination, Medium, Neutral",Usage Period : 1 month - 3 monthsPurchase Point : Shopee,pas retinol hype banget penasaran pengin coba sayang bunn kulit cocok samsek coba pakai minggu ku putus serah kulit bikin breakout parah purging orang breakout alam senang kulit believe produk cocok bikin nyiksa kali coba timbul jerawatjerawat soooo mari coba produk retinol cocok,2,Negative
"Combination, Medium Light, Cool",Usage Period : 1 month - 3 monthsPurchase Point : Shopee,cerita serum retinol kandung retinol teknologi enkapsulasi gentinol mampu stabil aman kulit sensitif formulasi ph tara ph kulit kulit iritasi kaya ceramide hyaluronic acid retinol lindung kulit radikal bebas anti polusi jaga kadar air lapis kulitteksturnya cair toner cepat resap kulit warna serum bening kuning lamakelamaan endap dasar botol kali pakai kocok aroma asam pakai aroma asam kuat cium tutup botol pipet ambil serumnyakalau foto warna serum coklat oksidasi banget sih pakai karenasayang kak  lagipula serkarang alami iritasi pakai alami purging jerawat mata langsung hilang pakai malam kadang sela pakai retinolselama pakai serum retinol banget tekstur kulit halus alami komedo bantu eksfoliasi rutin atas jerawat serum bantu jerawat cepat matang mata jerawat mendem bekas jerawat lumayan bantu pie bandel area pipi kanan bantu serum fokus brighteninguntuk kulit aman layer actives apa sela hydrating serumhydrating gel sela actives pakai bhahydrating serumretinol vit chydrating gelretinol hasil combonya mantulminusnya sebut serum lumayan cepat oksidasi rutin pakai simpan kulkas serum simpan kulkas takut lupa masuk lemari kena sinar matahari,4,Positive
"Oily, Light, Neutral",Usage Period : 1 week - 1 monthPurchase Point : Carousell,salah retinol beli mikir ingredientsnya simple ribet kandung oke banget kaget produk kandung terephthalylidene dicamphor sulfonic acid sunscreen proteksi sinar uva keren banget sih hahaha retinol anjur pakai pagi sih looks like aman pakai pagi better sih saran malam ya gengs ceramide kandung lumayan oke banget skin barrier guys sok far suka kulit cocok pakai guys zuzur rasa jos pakai retinol merk belah sih botol coklat ituw hehehehe personal opini ya tokcer pakai tahu retinol stabil bagus banget orang kulit sensitive kandung parfumeo alcohol selamat coba,4,Positive
"Combination, Medium Light, Neutral",Usage Period : 1 month - 3 monthsPurchase Point : Shopee,pakai oke oke giur ygain repurchase habis tekstur light cuman cepat nyerep bikin kering sih kupake lembab iya ya kayak pakai bottom tuh progressnya lembab ya doang stop rebuy goda produk lokal,4,Positive
"Oily, Medium, Neutral",Usage Period : 3 months - 6 monthsPurchase Point : AEON,retinol hasil main main kulit langsung kelar jerawat n bekas kulit kusam tekstur kulit baik serum sayang botol habis cocokwajah bruntusan jerawat gede ya pakai deh suka hasil,3,Neutral
"Combination, Medium, Neutral",Usage Period : Less than 1 weekPurchase Point : Shopee,kali coba retinol pas pakai sensasi lengket dikit kulit halus kerut dahi lumayan samar ngecilin pori pakai besok muncul bruntusan dikit rajin bersihin wajah pakai moga cocok,4,Positive
"Oily, Medium Light, Neutral",Usage Period : 1 month - 3 monthsPurchase Point : Shopee,retinol tering pertama skeptis bingung coba biasa pakai bakuchiol beli penasaran kecewa ringan banget dipakenya tekstur watery bau aneh langsung serap kulit timbul efek samping aneh jerawat calm tekstur kulit muka halus mind blowing deh moga fine les kulit pudar ya good job somethinc cinta deh retinol,5,Positive
"Dry, Light, Cool",Usage Period : 1 month - 3 monthsPurchase Point : Official Brand Store,serum retinol tekstur cair warna bening serum retinol bentuk cream kali coba cair kulit siy serum asa ringan retinolnya efek siy asa nampol sisi reda jerawat aging,4,Positive
"Combination, Medium Light, Warm",Usage Period : 1 month - 3 monthsPurchase Point : Shopee,jujur pakai produk habis rasa ubah signifikan kulit claim kemas sih help reduce aging signs wringkles darkspots hyperpigmentations large pores fine les makes skin brighter smoother claim bukti kulit fine les mata ubah bikin kulit brighter smoother least gentle bikin iritasi oh ya produk cepat oksidasi sih pengaruh efektivitas produk,3,Neutral
"Combination, Medium Light, Neutral",Usage Period : 1 month - 3 monthsPurchase Point : Shopee,sok love product produk retinol coba pakai hada labo alpha kandung retinolnya serum takut pakai kali minggu kulit adaptasi naikin level kali minggu hasil instant ya turut lambat mingu mingu pakai rasai ubah bulan pakai selang seling glow makernya somethinc hasil impresive really love kulit cerah bekas jerawat pudar langsung hilang mulus senang banget hasil bangun tidur bawaanya pengin kaca mulu kerut lihat ubah sih produk habis review lagiand one thing surprised muncul jerawat susah banget ilanginnya pakai jerawat itu langsung kering,5,Positive
"Oily, Medium Light, Neutral",Usage Period : 3 months - 6 monthsPurchase Point : Shopee,newbie retinol senang banget cocok produk claimnya encapsulated retinol formula aman segi packaging produk iring pakai ubah warna oksidasi ngaruh efektivitas produk kulit pakai kali minggu naikin frekuensi kali minggu kali minggu efek prominent tekstur kulit halus jarang jerawat cepat recoverynya bantu samar bekas jerawat benefits kayak samar pori tanda tua pay attention expect sok far suka produk repurchase sih,5,Positive
"Combination, Medium Light, Neutral",Usage Period : 1 week - 1 monthPurchase Point : Shopee,kacau banget coba produk kali pagi muka langsung bruntusan parah banget jerawat gede breakout nih gara gata produk mesti susah ilangin jerawat calon bekas jerawat nih,1,Negative
