Skin Type,Usage Periode,Review,Rating,Label
"Normal, Medium Light, Warm",Usage Period : 1 week - 1 monthPurchase Point : Brand website,kali pakai produk retinol ya khawatir efek purging coba pakai sesuai steps somethinc bareng hyaluronic niacinamide nya kaget pagi bangun tidur hasil glowing banget tekstur kulit lembab kenyal bekas jerawat pudar oiya lupa masuk kulkas serum ubah warna baca ig nya apa sih pakai tekstur ubah oil gel like,5,Positive
"Oily, Medium Light, Neutral",Usage Period : 1 month - 3 monthsPurchase Point : Shopee,takut pakai retinol takut purgingnya kalo ujungujungnya breakout beraniin coba maskne breakout garagara produk exfoliator pakai minggu kali hasil kecewa tekstur kulit benerbener bagus bantu banget kontrol jerawat jerawat cepat redam turut bikin kering kulit muka merah harga jangkau banget produk retinol recommended banget kali coba retinol,5,Positive
"Dry, Medium Light, Neutral",Usage Period : 1 month - 3 monthsPurchase Point : Instagram,abissmpet brenti pakecoba pakai sayang cocok retinolmasih strong mukakutiap pakai pagi kulit gradakanemang sih cerah bekas acne spot pudar dikittapi purgingnya lamaaacoba kupakein sayang habis sembuhmenyerah dehpake leher ,3,Neutral
"Normal, Medium, Warm",Usage Period : 1 month - 3 monthsPurchase Point : Shopee,ngefek apa flek hitam sebab matahari nih efek skintag muka bikin lembut ujung skintag henti numbuhbobok thanks maybe later coba varian,2,Negative
"Combination, Medium, Neutral",Usage Period : 3 months - 6 monthsPurchase Point : Shopee,tekstur produk cair runny pakai wajah langsung serap lengket produk retinol coba sayang produk cocok pakai malam dia bikin breakout henti coba bikin breakout stop,3,Neutral
"Combination, Medium Light, Warm",Usage Period : 1 week - 1 monthPurchase Point : Tokopedia,wow kaget sih wkwkkw pepet acara muka tekstur ku buka serum pakai efek lumayan loh kaget pas bsknya tekstur coba ku pakai seling aha bha somethinc lumayan nih muka edit break kaya serum eh pas pakai sembuh cepat  oh kulit ku bikin poripori buka gede jaya,5,Positive
"Dry, Dark, Warm",Usage Period : 1 month - 3 monthsPurchase Point : Tokopedia,honest review pakai habis botol tekstur suka cepat nyerep layering gampang hasil rasai banget sih kulit kencang ya kalo claim nya cerah hilang bekas jerawat pie dll sih pakai botol tpoverall suka efek retinol nya lumayan rasa repurchase yes oiya pakenya sih pump cepat banget nyerepnya spreadingnya sulit kalo dikit,4,Positive
"Oily, Medium Light, Neutral",Usage Period : 1 week - 1 monthPurchase Point : Beautyhaulindo,retinol serum pakai minggu struggling jerawat tekstur kulit produk peeling kandung aha bha pha habis bantu kondisi kulit coba retinol way soon kasih review hasil retinol butuh lumayan surprisingly tekstur kulit halus pakai layer hyaluronic acid serum iritasi purging overall one best purchases year,5,Positive
"Dry, Medium, Neutral",Usage Period : 1 month - 3 monthsPurchase Point : Shopee,retinol coba masuk botol sok far suka hasil banding retinol brand lainyg coba tekstur kulit dahi baik jerawat bulan muncul senang banget deh pokok,5,Positive
"Combination, Medium Light, Neutral",Usage Period : 1 month - 3 monthsPurchase Point : Brand website,pakai banget hasil kulit wajah halus milia kempes komedo kurang banget timbul pori tutup kulit wajah sehat banget sih,5,Positive
"Dry, Medium, Warm",Usage Period : 3 months - 6 monthsPurchase Point : Beautyhaulindo,retinol coba jujur love hate relationship pakai produk minggu pakai kali kulit kering tingkat intensitas pakai selangseling cosrx ahabha bulan kulit adaptasi muncul bruntusan area dahi sebentar pakai muncul maskne jarang jerawat area pipi tiga intensitas pakai kurang sadar jerawat cepat kempes bekas lumayan pudar pakai tekstur bentol timbul area kulit bilang produk mild tekstur lumayan cair cepat resap kulit retinol efek jangka putus break sebentar pakai alih bakuchiol mild,4,Positive
"Dry, Medium Light, Neutral",Usage Period : 1 week - 1 monthPurchase Point : Shopee,first retinol bagooosh banget kalo anjur pakai minggu kali langsung gas pakai malam amazed pas coba kulit kering pagi langsong kenyal nyoyyy lembut gitu pakai barengin rangkai whitelab cocok banget pas jerawat batu biji dont mind tuker hasil kulit lembut repurchase,5,Positive
"Combination, Medium Light, Warm",Usage Period : 1 month - 3 monthsPurchase Point : Shopee,retinol kupake lengket habis pakai muka annoying review bilang pakai tahap pakai malam cocok bekas jerawat cepat hilang dikombinasiin niacinamide tau efek pure retinol,5,Positive
"Dry, Medium, Neutral",Usage Period : 1 month - 3 monthsPurchase Point : Tokopedia,pakai bulan kali semingguyg tekstur kulit kencang halus lihat kulit kusam henti pakai baik tekstur kulit worth sih,4,Positive
"Normal, Medium Light, Neutral",Usage Period : 1 week - 1 monthPurchase Point : Tokopedia,perdana coba retinol retinol somethinc awalawal pakai banget hasil bikin muka cerah bikin jerawat ku gajadi muncul cepat kering lamalama kayak match skincare routineku ku jarang pakai,4,Positive
"Dry, Medium, Neutral",Usage Period : 1 week - 1 monthPurchase Point : Shopee,perdana coba skincare kandung bahan aktif kayak retinol kulit tipe susah ngefek kalo pakai skincare pas coba rasa banget sih efek milia ngecil tekstur kulit halus kulit muka shock ada retinol pakai pakai perih panas bawah mata stop pakai lagidan gapapabgt pas eh perih simpul retinol muka pakai kayak ya wkwkwkwk kali bgtkulit kuat ketemu retinol suka efek huaaaaa,4,Positive
"Combination, Medium, Warm",Usage Period : 3 months - 6 monthsPurchase Point : Beautyhaulindo,kali coba retinol usia pas lupa pakai kulit kelupas iritasi merah calmin pakai sheetmask hyaluronicnya tapiii pakai bulan bareng somethinc niacinamide work banget hilang bekas jerawat ngalusin tesktur wajah bau ganggu pas aplikasi wajah tekstur watery banget cepat resap lengket btw awet banget makenya sekali,5,Positive
"Combination, Medium Light, Neutral",Usage Period : Less than 1 weekPurchase Point : Shopee,sok far kali coba retinol kulit sih halus kenyal nimbul jerawat wajah kulit wajah super sensitif pakai skincare langsung ngefekdan bilang cocok akuitu alam pribadi ya,4,Positive
"Dry, Medium Light, Warm",Usage Period : 1 month - 3 monthsPurchase Point : Official Brand Store,start retinol coba sih somethinc deh retinol encapsulated safe even sensitive skin texturenya light slightly oil diapply slot serum fast absorbing without greasy feeling sensasi tingling perihperih super gentle pakai fine skintone tingkat pih pie fading gabikin kering ngelupas bikin burning wangi ganggu fragrance free highly recomended beginner,5,Positive
"Combination, Medium Light, Neutral",Usage Period : 3 months - 6 monthsPurchase Point : Beautyhaulindo,wow jujur banget satu produk retinol cocok ringan pakai pakai produk retinol keras kulit sensitif purging deh pakai purging bikin calon jerawat kempes malam,5,Positive
"Oily, Medium Light, Cool",Usage Period : 3 months - 6 monthsPurchase Point : Shopee,love product berani review guna takut pakai retinol takut efek harsh kulit raguragu beli produk ku sopan kalem banget kerja pakai minggu kali pakai emangsih habis pakai retinol kulit ku asa kayak kering telah pakai moisturizersleeping mask pakai kulit asa kering pakai retinol asa kulit ku plumpy bulan bekas jerawat hitam gede pelan kurang gelap ukur pas tambah niacinamide skincare routine cepat banget hasil bekas jerawat pudar sisa tinggal kulit plumpy moist fine les sok far pakai pengaruh cintak banget produk mula coba retinol cocok banget sih,5,Positive
"Oily, Medium, Neutral",Usage Period : 3 months - 6 monthsPurchase Point : Beautyhaulindo,produk kandung retinol coba jujur susah banget stock tam ekspektasi sih brand lokal wow muka ku cerah banget kontrol minyak jarang tumbuh jerawat pakai malam sajaa ya pakai pagi pakai spf menimbulkn jerawat aaaaa suka banget produk tekstur cair gampang serap hasil maksimal harga murah riah tunggu ayo coba,5,Positive
"Oily, Medium, Neutral",Usage Period : 1 month - 3 monthsPurchase Point : Brand website,ragu sih kali pakai retinol worth tiga pakai pakai purging dikit sih habis purging kulit kayak ngelupas dikit efek negatif bekas jerawat ilangan wow nya matengin jerawat banget jerawat mata nanah jam pakai retinol jerawat langsung kering bekas jerawat recommended banget repurchase yes banget,5,Positive
"Combination, Medium Light, Neutral",Usage Period : 1 week - 1 monthPurchase Point : Brand website,jerawat sembuh ku putus pakai retinol galau pakai avo ku putus pakai serum ngaruh muka rangkai somethinc lengkap say retinol overall kurasain pori pori rasa enak banget sih lembab banget pakai layering b niacin nya,5,Positive
"Dry, Medium Light, Cool",Usage Period : Less than 1 weekPurchase Point : Shopee,soldnyarinya susah ampun sekali cocok kulit acne prone dry skin nimbulin jerawat bagus baik tekstur kulit scarnya kecil pori pori bikin perih panas ngelupas glowing telah kasih serum hyalu tonernya pakai hydrating jual isi makenya taruh tangan pipet higienis beli tanggal kemarin lokasi jombang,5,Positive
"Combination, Light, Cool",Usage Period : Less than 1 weekPurchase Point : Shopee,yayyyyy retinol dua avoskin kurleb minggu kupake bit stronger lebib potent dikit banding avoskin turns aman banget pakai minggu efek kering gaenak lembap enak bingung pakai sih tetes jari langsung baurin muka runny encer banget jdnya kuratain tangan bentar langsung baur muka bau aneh siii minggu pakai efek pori enakbgt oaling rasa bekas jerawat lebib kalem sih kilas pudar well sih depan ya,5,Positive
"Combination, Medium Light, Neutral",Usage Period : 1 month - 3 monthsPurchase Point : Beautyhaulindo,coba retinol sebelumnyatelat banget emgpackaging ukur pas ml botol hijau gelapcukup bagus mengungat vita stabil cahaya udara tekstur kuning coklat cepat serap lengket aplikasikanformula kandung ceramideyg bantu jaga kembali skin barrier koreksi kalo salah vit nya enkapsulasi vita nya stabil realita warna kuning coklat cepat ubah coklathuhu efek muka benar ilangin flek hitam ku wajahsignifikan lho mnurutku cekit pakai area dahi kering umur oia buatacne spot kurang banget lumayan ukur lokal lahrepurchase nomau coba brand ,5,Positive
"Dry, Light, Neutral",Usage Period : 3 months - 6 monthsPurchase Point : Shopee,akhirnyaa back welcome back retinol retinol kunci sih cocok banget produkproduk skincare kandung retinol kulit alami sembuh pakai retinol manfaat retinol cantik kulit antiaging sembuh jerawat kecil poripori henti retinol hamil susu awal guna retinol rekomendasi sih somethinc level kandung retinolnya rendah banding product tuh mix hyaluronic acid fungsi melembabkan guna bikin kulit wajah hidrasi kering telah pakai malam guna niacinamide night cream efek guna bulan warna kulit wajah rata hilang noda bekas jerawat kecil poripori cerah cepatbangun pagi kulit wajah langsung asa bahagia hahahah duh ya bahasa jujur semenjak pakai retinol yes skin love,4,Positive
"Normal, Medium Light, Neutral",Usage Period : 3 months - 6 monthsPurchase Point : Beauty Studio,pas pengin beli pas langkabahkan officialnya kosong alhamdulillah beuty studio syukaaa banget jenis retinol kayak ginimild keringga biikin ngelupas dah krg nyaman kulit kulit asik pakai inidan efek cocok meong,5,Positive
"Combination, Light, Warm",Usage Period : 3 months - 6 monthsPurchase Point : Beautyhaulindo,pakai botol abisga berefekapa retinolnya brand pakai retinol bikin bruntusan kulit merah sih bikin kulit terkelupashanya pakai malam haribotolnya,4,Positive
"Oily, Medium, Neutral",Usage Period : 1 month - 3 monthsPurchase Point : Shopee,first thing first skin type sensitive acne prone oily dull muka gue break parah gara-gara pakai benton essence yaudahlah stop pakai pakai retinol ordinary muka gue langsung merah banget kayak lobster september berani pakai retinol pilih avoskin harga affordable somethinc ku pakai daaaaaaaaan pakai suka puas kulit jerawat breakout akibat benton mulus tekstur kulit ku gampang jerawat tinggal bekas nya iniiii bekas jerawat pudar pakai jeda kali minggu pakai retinol day always apply sunscreen pakai malam pakai campur aloevera shooting gel nya innisfree parah bikin iritasi kulit love moga kulit ku mulus hilang bekas jerawatdark spots nya,5,Positive
"Normal, Medium Light, Neutral",Usage Period : 3 months - 6 monthsPurchase Point : Brand website,cari retinolku coba retinol lumayan rendah kadar gue berani coba kadar turns wow pakai langsung harga murah riah banget cinta mati,5,Positive
"Oily, Medium Dark, Warm",Usage Period : 1 month - 3 monthsPurchase Point : Shopee,kali coba retinol aman muka gue lumayan sensitif gue makenya kali minggu gue pakai refining serum nya avoskin kali minggu beda gue kalo somethinc efek ngempesin jerawat gue tumbuh gajadi nongol gue pakai avoskin kalo jerawat kalo muka cerah dark spot cepat hilang sih gue ya somethinc avoskin efek pakai produk mantul deh muka gue,5,Positive
"Dry, Medium Light, Warm",Usage Period : 1 month - 3 monthsPurchase Point : Brand website,semenjak produk launched tuh nyarinya kali bulan pakai serum retinol cari mild encapsulated retinol tampak coba minim efek iritasi stabil ingredient unggul hyaluronic acid allantoin ceramide dll bulan pakai tekstur kulit plump cerah bantu samar acne scars pori pori bikin kulit halus gong sukses ngeangkat kulit sekitar smile les kering bulan kemarin kulit dehydrated wuah kayak pakai serum high end loh resultnya percaya harga affordable minggu pakai sih deg degan timbul jerawat gede serum pms pakai syukur ngelewatin purging bo bikin kulit kering iritasi pakai pm routine one drop wangi strong tekstur cair,5,Positive
"Normal, Medium Light, Neutral",Usage Period : Less than 1 weekPurchase Point : Beauty Studio,bagus banget mah serum bawjib wajib nangett ciwi ciwi ampu banget hilang bekas jerawat ban melembabkan kulit wajah auto glowing deh pakai sih ampuh pol banget,5,Positive
"Combination, Light, Cool",Usage Period : 1 month - 3 monthsPurchase Point : Shopee,dabest badabum layerin niacinamide nya bombastis bekas jerawat hilang somethinc sulit cari lop yuk repurchase recommended abisssss mantap yahut makblar,5,Positive
"Oily, Medium Dark, Warm",Usage Period : 1 week - 1 monthPurchase Point : Shopee,kali banget pakai retinol takut sih hehe pakai retinol dibarengin serum niacinnya somethinc telah pakein moist cos rx oil free hasil sih lumayan bagus jerawat besok kempes kulit wajah bagus pakai minggu kali minggu blunder banget pakai besok kulit hidung ku kelupas sakit ya kayak kelupas tipis ya salah ku sih serum bagus pakenya,4,Positive
"Combination, Medium, Neutral",Usage Period : 1 week - 1 monthPurchase Point : Shopee,gunain efek kulit kenyal gampang jerawat ampuh rata tekstur kulit samar poripori rasai efek retinolnya samar garis halus area mata pakai bulan depan efek cegah kurang tua kulit repurchase produk,4,Positive
"Combination, Medium Light, Cool",Usage Period : 1 month - 3 monthsPurchase Point : Shopee,bagus banget benerin tekstur kulit pas awalawal pakai purging minggu area dahi dagu jerawat hilang tekstur kulit baik pakai malemnya pagi muka halus kayak repurchase habis,4,Positive
"Combination, Medium Light, Neutral",Usage Period : 1 month - 3 monthsPurchase Point : Shopee,bagus banget jerawat kontrol banget sakitt banget semenjak pakai jerawat kontrol banget jerawat gede hilang jarang jerawat serius cinta banget product susah banget beli sold nya cepat banget ,5,Positive
"Oily, Medium Light, Warm",Usage Period : 3 months - 6 monthsPurchase Point : Shopee,serum bagus banget benerbener bikin wajah enak halus bersih lembut bikin jerawat benerbener gentle retinol nya mula tuh benerbener best banget,5,Positive
"Combination, Medium, Neutral",Usage Period : 3 months - 6 monthsPurchase Point : Shopee,serum somethinc pakai mnrtku serum pulang sakti sengaja pakai pas muka bruntusan kecil mlmnya pakai surprisingly pagi bruntusan hilang pakai minggu kali minggu pakai untung efek kemerahanperih dll sih muka bagus hari cinta banget pokok sih retinol sayang susah banget nyarinya suka kewalahan kalo restock,5,Positive
"Normal, Medium Light, Warm",Usage Period : 1 month - 3 monthsPurchase Point : Shopee,pakai kulit merah tanda jerawat muncul bruntusan isi komedo iya jerawat komedo muka kulitefek retinol ubah heboh minggu pakai minggu pakai tone kulit bikin bekas jerawat  minggu pakai tekstur kulit rata gradakan purgingku selesai minggu muncul jerawat lifestyle sehat begadang  alhamdulillah membaikdengan retinol bekas jerawat cepat pudar kerut dll tau,5,Positive
"Dry, Light, Neutral",Usage Period : 3 months - 6 monthsPurchase Point : Beautyhaulindo,first time pakai retinol pakai bahan aktf golong gentle banget kulit sensitive awlnya baca pakai tahap kulit langsung pakai hari pakai wajib banget pakai pelembab extra dry kulit dry semenjak pakai jujur komedo hidung banget kurang sih hijau cabe rawit cocok banget pakai niacinamide hyalu love banget,5,Positive
"Oily, Medium Light, Neutral",Usage Period : 1 month - 3 monthsPurchase Point : Shopee,tekstur cair warna rada keruh bau manismeresapnya cepat lengket efek rasai bulan pemakaianjerawat muncul kontrol muncul jerawat gede sakit alih doi inidengan berat hati doi simpan dikulkaskarena botol lihat kayak seratserat dasar botol bintikbintik coklatnyapernah share fees fd dasar lampir dm somethinc dengan masalahtidak kualitas berubahhanya masuk kulkas pakai kocok monmaap lupa share kulit doi ku pakai bau pekat banget kayak bau manis madu benerbener pekat susah deskripsi ngalamin muncul jerawat muncul diaada pipi tulis jerawat kempes alas pakai tinggal empat lagiaku ambil resiko,4,Positive
"Combination, Medium Light, Cool",Usage Period : 1 week - 1 monthPurchase Point : Shopee,bagus banget benerin tekstur kulit pas awalawal pakai purging minggu area dahi dagu jerawat hilang tekstur kulit baik pakai malemnya pagi muka halus kayak repurchase habis,4,Positive
"Combination, Light, Warm",Usage Period : 6 months - 1 yearPurchase Point : Shopee,salah produk holy grail dapetinnya susah banget kayak hunger games packingnya aman travel friendly tekstur cair cepat resap kulit hasil rasa pakai botol ku asa banget efek kulit sehat kenyal glowing oh ya pakai produk malam tidur biar kering pakai toner ngelembabin telah pakai masker moisturizer melembabkan pas bangun pagi asa banget muka kenyal glowing pokok cinta banget produk,5,Positive
"Normal, Medium, Warm",Usage Period : 1 week - 1 monthPurchase Point : Tokopedia,pakai retinol serum somethinc kulit mild asa kencang retinolnya bikin kering selang seling pakenya cinta hasil baik banget tekstur kulit ku bekas jerawat pih ku lumayan kurang sok happy oh ya warna hijau ungu packagingnya gemas banget,4,Positive
"Combination, Medium Light, Neutral",Usage Period : 1 month - 3 monthsPurchase Point : Shopee,retinol lokal votre peau suka hasil suka somethinc giur mbak deszel repurchase serum pengin coba beli produk somethinc kemas dus botol serum bungkus wrap plastik kandung encapsulated retinol guna rasa efek retinol kuat perlahan cair serum warna kuning tekstur encer persis air cepat resap aplikasi rampung hidrasi kulit eye cream serum efek rasa bantu pulih jerawat bikin tekstur kulit bagusaan banget tampil poripori kecil bekas jerawat cepat pudar  alami purging parah kali pakai serum alami bo maskne parah purgingnya lumayan minggu muncul jerawat sakit  purging hasil bagus  pakai serum oh ya serum retinol bikin drying lumayan kencang pasti step hidrasi supple imbang efek dryingnya,5,Positive
"Oily, Medium, Neutral",Usage Period : 3 months - 6 monthsPurchase Point : Shopee,packaging kaca warna hijau pipet sok far good ambil produknyakonsistensi cair warna kuning muda gampang oksidasi simpan lemari aroma ganggu kalo ubah warna aroma rada strongreviewno purgingkayaknya retinol ter gentle coba efek purgingbangun pagi muka langsung lembutt perhati jerawatkuu tumbuh terkontroluntuk bekas jerawat notice perlahan pudar dukung skincare yaaku pakai minggu tingkatin kali minggu deh malam pakai somethinc kalo exfo pakai retinol yaaaaminusnya retinol susah banget dapatin kudu rebut gampang oksidasi sih kalo ubah warna efek negatif siii,4,Positive
"Combination, Medium Light, Warm",Usage Period : 1 week - 1 monthPurchase Point : Shopee,tuh ragu sih pakai takut bikin break muka sensitif suka banget serum tekstur tuh cair warna coklat bau sengat sih bau serum bikin tekstur muka baik sih bekas jerawat pudar jerawat cepat kempes muka cerah pakai hilang milia retinol hilang milia ya pakai sih langsung hilang milianya rutin makenya hehe,5,Positive
"Combination, Medium Light, Neutral",Usage Period : 3 months - 6 monthsPurchase Point : Instagram,takut pakai produk kandung retinol kesan keras wajah sensitif pakai nya gue rasai hasil banget kalo gue pakenya minggu kali totol daerah butuh bekas jerawat mata hasil maksimal pakai muka oh iya lupa pakai sun screen pagi kalo pas malam pakai,5,Positive
"Combination, Medium Light, Neutral",Usage Period : Less than 1 weekPurchase Point : Shopee,sold out aku kali pakai hubung umur masuk takut nerusinnya lanjut somethinc b hyaluron kalo minat dm instagram ya hihi natasyaslsb,5,Positive
"Combination, Medium, Warm",Usage Period : 1 week - 1 monthPurchase Point : Official Brand Store,preloved isi beli tanggal oktober simpan kulkas ya pakai ganti skincare regime sayang kalo dianggurin ribu free ongkir sejadetabek ya dm ig kartikaamd,5,Positive
"Oily, Medium, Neutral",Usage Period : Less than 1 weekPurchase Point : Shopee,sold pakai segel tau pakai underaged lanjur beli claimnya bagus banget pengin hilang bekas jerawat tt minat dm randjun,5,Positive
"Combination, Medium, Warm",Usage Period : 3 months - 6 monthsPurchase Point : Shopee,retinol pertama langsung keranjingan bagus banget untung purging doi bikin jerawat cepat mateng muka asa plumpy cerah bagus deh pokok kalo duet serum serum aha nya avoskin weeeew bangun muka glowing banget beb asli kakak muji muka wkwkwk senank,5,Positive
"Combination, Medium Light, Neutral",Usage Period : 1 month - 3 monthsPurchase Point : Shopee,retinol bilang presentase aman texturenya cair banget bau khusus sok far pakai jerawat ku baik hyperpigmentation ku kurang overall bagus banget harga affordable,5,Positive
"Oily, Medium Dark, Neutral",Usage Period : 1 month - 3 monthsPurchase Point : Shopee,pakai retinol kali nyantol somethinc minggu pakai kali minggu rencana minggu tiga besok dinaikin kali efek negatif tau efek jerawat cepat matang cepat kempes pakai bareng tamanu oil minggu pakai serum manfaat cerah produk banget sih dark spot pih pelanpelan banget pudar aneh pakai retinol kulit kering  kulit lewat minyak ohya pakai jauh selang hari ahabha deket,5,Positive
"Oily, Medium Light, Neutral",Usage Period : 3 months - 6 monthsPurchase Point : Shopee,produk retinol lokal ciamik banget harga affordable gue pakai gentle banget gue pakai bawah eye gue bau nya bau kimia banget kayak retinol gue suka ceramide ingredient nya bagus skin barrier anti aging hasil nya bagus fine line eye gue pudar banget garis halus smile les pudar gue pakai selang seling copper peptide gue kasih bintang super cepat banget okaidasi nya ubah warna coklat warna bening kuning pas beli gue simpan tas tutup rapat kena sinar matahari cepat banget oksidasi nya gue coba simpan kulkas kalo worth pakai share orang biar habis nya botol nya bikin warna gelap kayak slow proses oksidasi nya sedia kemas ml bikin sistem pump keluar nya terus kena udara pas buka bikin cepat oksidasi nya oh ya guys pakai sure beli produk nya expiry date depan beli expiry date oksidasi sok iya oksidasi biggest issue banget produk super suka hasil nya,3,Neutral
"Combination, Dark, Neutral",Usage Period : 6 months - 1 yearPurchase Point : FD Flash Sale,takut breakout alergi kalo ganti serum bod shp kulit sensitif turns sok gewd kulit cerah lembab warna kulit muka rata sesuai klaim guna bahan retinolnya affordable kemas mudah bawa tekstur cair sok thick cepat resap muka terluvv definitely repurchase,4,Positive
"Oily, Medium Light, Warm",Usage Period : Less than 1 weekPurchase Point : JD.id,olshop sold  id stok hihihihi  auto pesan dunks coba besok malam minggu sih bekas jerawat jerawat bulan atur pakai nya senin rabu jumat khasiat  manjur banget bekas jerawat pipi dahi samar hitam banget dempul foundation tutup bekas jerawat butuh bulan rasa khasiat hihi bebas pakai cushion  bekas jerawat item samar hihihi,5,Positive
"Normal, Light, Cool",Usage Period : 1 month - 3 monthsPurchase Point : Shopee,produk magic tau guna pakai bruntusan hilang jarang jerawat texture mulus poripori ngecilin kayak jaga muka tuh sayang produk jarang banget ditemuin huhuhu,5,Positive
"Dry, Medium Light, Neutral",Usage Period : 1 month - 3 monthsPurchase Point : Brand website,kulit sensitif kering bilang serum coba kali serum bahan natural rutin pakai akibat nontonin influencer skincare psbb caricari retinol mild konsisten arti review purging sideeffectnya hehe pilih jatuh retinol somethinc serum gentle muka ku konsistensi kental serap cepat kulit jalan pakai serum retinol malam ekspektasi ambisius sok far sok good purging indikasi alergi orang rumah temanteman kerja virtual  suka komen muka cerah sih cihihihi  oiya spot langgan jerawat kecilkecil bersih jerawat hormonal muncul time month pagi langsung kering somethinc s retinol definitely became goto active purchased indak one,5,Positive
"Oily, Medium Light, Neutral",Usage Period : Less than 1 weekPurchase Point : Shopee,prtma pakai rasai cerah cepat matengin jrwat klmaan aga bikin kering dkulit temenku cocok banget pakai muka bagus banget ya produk ccokkan sih orang beda kulit,4,Positive
"Dry, Medium Light, Neutral",Usage Period : 1 month - 3 monthsPurchase Point : Tokopedia,tekstur cair warna kalo salah hijau ya lupa beli pakai empties jual ku lengket muka ku ganggu banget pakai bareng sih hyaluronicnya efek anti agingnya beli disc bunlde sorry sorry jodoh coba mula kenal retinol kandung retinol nya,3,Neutral
