Skin Type,Usage Periode,Review,Rating,Label
"Combination, Medium Light, Neutral",Usage Period : More than 1 yearPurchase Point : Sociolla,serum retinol kandung tinggi pakai suprisingly efek tingling cekat cekit pas ku pakai tekstur light cenderung watery pas apply langsung cepat serap rasa kayak pakai apaapa pakai serum rasai efek apaapa sih bangun pagi rasa lifting wajah segi harga kandung serum worth price worth try,5,Positive
"Oily, Medium, Neutral",Usage Period : 3 months - 6 monthsPurchase Point : Shopee,degan retinolnya mild bikin purging biarpun kulit sensitif kayak ya efek bikin kering cepat resap cocok mula sih biasa retinol puas,4,Positive
"Dry, Medium, Neutral",Usage Period : More than 1 yearPurchase Point : FD Try and Review,satu retinol serum lokal produk kali repurchase retinol kulit sensitif acne prone plus dry ngebuat drama kulit kali pakai riwayat kulit sensitif worry coba pakai minggu kali kenal kulit coba pakai orang bilang pakai papa pakai biar kulit wajah rewel sensitif efek rasa kulit wajah lembut banget halus baik tekstur banget coba serum ,5,Positive
"Normal, Medium Light, Neutral",Usage Period : 1 month - 3 monthsPurchase Point : Watson,coba serum retinol votre peau merk tingkat retinol tinggi merk untung pas pakai ok perih bikin muka kering pas bangun tidur muka oke oke,5,Positive
"Combination, Medium, Neutral",Usage Period : 1 month - 3 monthsPurchase Point : Brand website,hitung skincare retinolnya bilang mild ya pakai bad effects purging dryness dll maka seling cocok pakai produk wow botol oiyaaa produk encer kental ya,4,Positive
"Combination, Medium Light, Neutral",Usage Period : 1 month - 3 monthsPurchase Point : Shopee,jujur takut banget coba pakai retinol khawatir efek kalo cocok retinol gentle muka sensitif tingling effect panas kering kemas simple elegan aplikator bentuk pump atur pakai produk tekstur watery wangi sengat mudah resap klaim salah retinol samar kerut halus baik skin barrier sok far nyaman aman pakai retinol muka bikin jerawat kering cepat love,5,Positive
"Dry, Medium, Neutral",Usage Period : 1 month - 3 monthsPurchase Point : Sociolla,kali pakai retinol cocok sedih beli lihat review orangorang cocok salah pakai ikut cycling skin efek bikin kering muka komedo,3,Neutral
"Combination, Medium, Neutral",Usage Period : 1 week - 1 monthPurchase Point : Shopee,beli retinol tuh kayak cari jodoh ya cocok breakout parah kalo cocok muka bener gemas banget lihat coba ekspektasi apa lihat ukur ml nya lumayan ml eh cocok banget efek fine les sedikit pudar gal habis pikir retinolnya kandung lumayan ya rasa mild pakai mula coba retinol,4,Positive
"Dry, Medium Light, Warm",Usage Period : 3 months - 6 monthsPurchase Point : Shopee,iseng beli retinol diskon official store nya star ingredient nya retinol cyclosystem complex klaim nya baik skin barrier samar kerut halus kurang komedo dll sayang nya doesnt work pakai retinol pakai serum kandung retinol tuh pengaruh apaapa kulit pakai rutin minggu kali habis botol serum cocok pakai kulit sensitif tekstur serum nya watery gampang resap efek cekitcekit merah harga lumayan mahal ribu repurchase,4,Positive
"Combination, Medium Light, Neutral",Usage Period : 6 months - 1 yearPurchase Point : Sociolla,retinol serum kalah bagus merk think one best market formula efektif hilang bintikbintik wajah samar bekas jerawat remaja kulit packagingnya juka oke simpel enak bawa traveling,5,Positive
"Combination, Medium, Warm",Usage Period : More than 1 yearPurchase Point : Lazada,retinol turut pas mula pakai retinol serum mild banget hydrating lengket efek negatif kalo harga murah ratus ribu perfect kecuali kemas botol pipet tekstur gel kental banget ambil pipet heran deh turut bagus kemas botol pump harga beli gara botol level kadar retinolnya,4,Positive
"Combination, Medium, Neutral",Usage Period : 3 months - 6 monthsPurchase Point : Shopee,coba retinol ajar ngenalin kulit pakai retinol please coba ini walaupun persentase retinolnya trgolong keci hasil mantap kulit notice sih pori samar bantu ngurangin bruntusan serum retinol bikin tingling kering lembab wajah pas pakai gampang nyerep lengket tekstur gel bening bau wajah golong sensitif nyaman rekomen banget sih coba,5,Positive
"Oily, Medium Light, Cool",Usage Period : 1 week - 1 monthPurchase Point : Partnership,airinderm aesthetic retinol serum suguh tekstur gel bening kental lengket cepat serap pas banget kena layering serum tutup moisturizer malam lengket ganggu ya rasio retinol kandung serum mana untuk coba main retinol lirik produk kandung peptide sunti dalam fungsi retinol nikmat kulit kasih nutrisi peptidenya kandung sodium hyaluronatenya isi ml hidrasi kulit bikin halus tipikal serum retinol asih efek drying bikin tingling lembap kulit wajah kulit diasupi retinol advance notice efek sok saran cobacoba retinol gentle wajib coba deh ,4,Positive
"Combination, Medium Light, Neutral",Usage Period : 1 month - 3 monthsPurchase Point : PR Package,retinol tekstur unik senang tekstur gel cepat serap lengket wangi oh ya turut retinolnya airin rekomendasi cobacoba retinol kalo pakai konsisten hasil kalo retinol mild pakai kulit orang beda ya kerja retinolnya kalo kuat ya pakai kenal retinol jerawat tuh atas retinol,5,Positive
"Combination, Medium, Warm",Usage Period : 1 month - 3 monthsPurchase Point : Brand website,produk airn coba niacinamide gel nya teksture nya kental cepat serap wajah bau wangi alhamdulillah cocok pakai timbul bikin kulit halus suka nimbul bruntusan lembab pakai moisturizer retinol avoskin pakai,5,Positive
"Dry, Medium, Cool",Usage Period : 1 week - 1 monthPurchase Point : Official Brand Store,pakai reaksi tingling merah merah drama apa feel nya kayak pakai serum serius feel cekat cekit pakai sengaja pakai skincare melembabkan banget step nya tau feel retinol nya reaksi negatif asa kayak pakai serum doangnext pakai minggu pakai sok far kulit aman aman retinol serum bantu ngempesin beruntus recovery bekas jerawat retinol serum lumayan bantu hempas jerawat jidat hp kereset hitung cepat pakai retinol serum bikin kulit keringdrying cepat resap tekstur nya gampang melted kena kulit,5,Positive
"Combination, Medium Light, Neutral",Usage Period : 1 month - 3 monthsPurchase Point : PR Package,alas  rekomendasi formulasi tekstur super ringan tekstur gel bening aroma apapaun kental mudah lumer cepat resap aplikasi wajah  persentase retinol nya mild mula takut pakai retinol aktif pakai retinol cari kalem pick one  kering tarik produk produk kandung humektan butylene glycol sodium hyaluronate kandung peptide lembab kulit efek tebak produk hasil instan sesuai baca review pakdhe danang antioksidan exfoliator hasil butuh pakai retinol rutin malam oktober habis hasil maksimal puas kondisi kulit sehat kulit parah fokus basic skincare tambah retinol oya size serum ml jual harga rp mahal murah gantung kocek masingmasing ya turut worth buy sih jatuh lumayan awet pakai nya tetes lumayan,5,Positive
"Oily, Medium Light, Neutral",Usage Period : 1 week - 1 monthPurchase Point : Shopee,salah rekomendasi produk retinol cocok mula wajah sensitif produkproduk kandung retinol efek iritasi ringan produk kandung retinol kuat syukur cocok produk pakai efek produk cerah wajah,5,Positive
"Oily, Medium, Neutral",Usage Period : 1 week - 1 monthPurchase Point : Official Brand Store,jalan retinolku clinique retinol booster campur moisturizer coba skin sake avoskin retinol serum airin bikin baik kulit gue  ginigini  next coba pure retinol somethinc kayak advance treatment,3,Neutral
"Dry, Medium Light, Neutral",Usage Period : 1 month - 3 monthsPurchase Point : Shopee,produk retinol coba takut coba retinol gampang bikin iritasi dll coba brand konsentrasi retinolnya cocok mula pakai suka banget bikin kulit lembut glowing pakenya minggu kali mula disaranin pakai selang seling bagus banget recommended mula coba retinol kayak,5,Positive
"Combination, Medium Light, Warm",Usage Period : 1 week - 1 monthPurchase Point : sociolla,cocok produk tau cocok kandung mula retinol coba ngkutin pakai pakai minggu hasil muncul jerawat pecah tunggu kempes,1,Negative
"Dry, Medium Light, Neutral",Usage Period : 1 month - 3 monthsPurchase Point : Shopee,recommended pakai retinol gentle banget gakada iritasi efek melembabkan cerah hilang noda baik tekstur kalo pakai retinol tante pakai retinol serum hasil,4,Positive
"Oily, Medium Light, Warm",Usage Period : 1 month - 3 monthsPurchase Point : Shopee,bagus bagus sih kulit ubah signifikan kayak cerah pamakaian kulit acne ya ubah apa kulit,3,Neutral
"Combination, Medium Light, Cool",Usage Period : 1 week - 1 monthPurchase Point : Shopee,pakai kali sih ubah muka rasai halus muka ku habis pakai tekstur cair gampang nyerep bau nya nyaman pakai pakai minggu kali,5,Positive
"Combination, Medium, Neutral",Usage Period : 1 week - 1 monthPurchase Point : FD Try and Review,tekstur kental cepat resap dalam kulit bagus encang jaga kulit awet muda pakai kulit kencang mulus pakai sesuai dosis jadwal kandung aktif,5,Positive
"Dry, Medium Dark, Warm",Usage Period : 1 week - 1 monthPurchase Point : Sample,best retinol ever pakai retinol kulit super kering pakai banget ubah kulit halus kenyal beruntus kurang kulit super kering pakai nya minggu lupa dibarengin moisturizer ya gurls,5,Positive
"Oily, Light, Warm",Usage Period : 1 week - 1 monthPurchase Point : FD Try and Review,nya thank lu fd try n review deh kasih sempat sekian kali pilih cinta retinol produk skintific deh raguin moisturizer nya pakai retinol skintific saat jerawat kita rahang pakai mula saran ya bikin jerawat rahang cepat kering bikin amaze nih bikin kering sekaliiiiiii wajah lembab ganggu makeup pagi nya kering,5,Positive
"Dry, Light, Cool",Usage Period : 1 week - 1 monthPurchase Point : FD Try and Review,takut takut kalo coba retinol kepo banget retinol baru skintific pas coba signifikan banget kulit kulit lumayan asa cerah moga konsisten ngatasin kulit lain ya,5,Positive
"Dry, Medium Dark, Neutral",Usage Period : 3 months - 6 monthsPurchase Point : Shopee,maju mundur coba retinol takut purgingiritasi ya deh cari mild cocok mula berani checkout toko oren eh coba ya ampun bagus banget hasil kulit  jerawat gede bagong kempes diolesin retinol malam minggu angsur kempes sembuh total bekas item banget catat combine moisturizer mampu melembabkannya bagus kalo kulit ngelupas hihi sayang bahan aktif pakai bumil ya hibah sodara rencana hamil ,5,Positive
"Dry, Medium, Cool",Usage Period : 6 months - 1 yearPurchase Point : Shopee,kira ngelembabin blnan bekas jerawat hilang gasengaja pencet pakai pagi merah banget muka efek gabikin jerawat stop ngefek coba retinol banding merk si ngefek,5,Positive
"Combination, Medium Dark, Neutral",Usage Period : 6 months - 1 yearPurchase Point : Guardian,bagus bangetcocok banget mula bikin iritasi cepat banget hilang jerawat bekas mencerahkanteksturnya ringan cepat resap efek pemakaianpokoknya repurchase,5,Positive
"Dry, Medium Light, Neutral",Usage Period : 1 week - 1 monthPurchase Point : Shopee,beli serum paket moisturizernya amanaman pakai bareng serum moisturizer retinol skintific tekstur watery gel runny banget kandung bagus banget retinol serum kandung peptide ceramide bagus lembap kurang garis halus jaga skin barrier love,4,Positive
"Oily, Medium Light, Neutral",Usage Period : 1 month - 3 monthsPurchase Point : Shopee,pengin coba serum retinol tau brand cocok muka pakai skintific oke timbul jerawat kynya muka kenyal bersih bekas jerawar moga cepat pudar,5,Positive
"Dry, Light, Neutral",Usage Period : 3 months - 6 monthsPurchase Point : Shopee,mantul banget rasa banget wajah muka halus hilang kerut halus repurchase sih hatrganya masuk kantong gentle bikin kulit keringmalahan rasa lembabnya worth buy deh,5,Positive
"Dry, Medium Light, Warm",Usage Period : More than 1 yearPurchase Point : Shopee,salah retinol gentle banget lightweight fastabsorbing serum watery texture wonders blemishes acne bit challenging blend due unique texture gamechanger reducing breakouts blemishes leaving skin plump please note gentle rutin pakai retinol ya,4,Positive
"Oily, Medium Light, Neutral",Usage Period : 1 week - 1 monthPurchase Point : PR Package,suka banget serum gentle encapsulated aman pakai even beginner tekturnya nyaman cepat resap bulirbulirnya pudar bikin firming jerawat kayak keren banget produk,5,Positive
"Oily, Light, Cool",Usage Period : 3 months - 6 monthsPurchase Point : Brand Website,suka pakai banget retinol baik mantap banget bikin wajah glowing halus kecil pori pakai selang seling serum exfo niacinamaide hasil bagus banget cocok liat jerawat minyak,5,Positive
"Normal, Medium, Warm",Usage Period : 3 months - 6 monthsPurchase Point : Shopee,texturenya enak bulir halus dalam serum easy apply paham percentage retinol dalam pakai ku aman banget efek kering pakai percentage retinolnya sok far aman nyaman kulit mula,4,Positive
"Combination, Medium Light, Neutral",Usage Period : More than 1 yearPurchase Point : Shopee,coba pakai retinol coba deh pakai gentle encapsulated keras kulit kali pakai retinol pakai minggu kali pakai sunscreen besok sok far aman banget mulus kulitkuu,5,Positive
"Dry, Light, Cool",Usage Period : More than 1 yearPurchase Point : Shopee,retinol bagus banget mula encapsulated harsh kulit serum dikombinasiin moisturizernya deh perfect combo ngelembapin kuliiit banget muncul jerawat kalo pakein serum tuh langsung hilang paginyaa gajadi muncul huhu love banget pakai banget hasil darkspot pudar smiling line pudar,5,Positive
"Oily, Light, Cool",Usage Period : More than 1 yearPurchase Point : Shopee,turut retinol nyaman mula pakai kali minggu suka pakai malam pagi kulit rasa kenyal plumpy skintific sensasi panas bikin ngelupas kesan harsh kulit catat wajib apply sunscreen besok pagi ya lengkap hasil sih turut,5,Positive
"Oily, Light, Neutral",Usage Period : 1 week - 1 monthPurchase Point : Shopee,pakai bareng truffle biome skintific cepat serap hidrasi kulit sok far kulit pakai malam besok pagi asa lembab kenyal asa sehat banget kulit,5,Positive
"Combination, Medium Light, Warm",Usage Period : More than 1 yearPurchase Point : Tokopedia,coba smile line panik pasti iklan skintific retinol sliweran feed mikir cowok beli minus pakai tau pakai produk bruntusan  cocok kagak ngarti ku abisin sayang  tekstur kental wangi ringan banget,3,Neutral
"Combination, Medium, Neutral",Usage Period : 1 month - 3 monthsPurchase Point : Shopee,produk lucu konsistensi gel bening encapsulated retinol beadsnya pecah usap kulit hitung retinol serum moisturizer retinol skintific bagus timbul purging efek negatif panas gatel kulit merah pakai malam efek bagus bantu mulus kulit wajah leher downsidenya habis pakai glitter emas kilap kulit,4,Positive
"Combination, Medium Light, Neutral",Usage Period : More than 1 yearPurchase Point : Sociolla,serum retinol coba ya harga affordable banget makek nya pas malam tidur pagi bikin kulit kenyal layer moiisturiser hasil maksimal sok far satisfied result nya,5,Positive
"Normal, Medium, Neutral",Usage Period : 1 month - 3 monthsPurchase Point : Shopee,produk bilang ngaruh kulit bagus jelek inti tarik beli kemas bagus buat botol kaca transparan mewah reviewnya bagus kulit mending pakai retinol olay mi kulit serum skintific cocok mula pakai retinol,3,Neutral
"Oily, Medium Light, Neutral",Usage Period : 1 week - 1 monthPurchase Point : Shopee,beli review tiktok bilang retinol bagus banget pas pakai cocok bikin jerawat tipe kulit oily acne pakai efek kayak tarik cuman ya cocok lanjut pemakainnya,2,Negative
"Dry, Medium, Neutral",Usage Period : 1 week - 1 monthPurchase Point : Blibli.com,tarik iklan seliwer socmeddan pengin coba pakai krim koreatapi krim cocok muka akumuka kering banget beruntus,2,Negative
"Normal, Light, Cool",Usage Period : 1 week - 1 monthPurchase Point : Shopee,bagus pol suka pakai bunda cocok coba pakai malam dannn taraaa bangun bangun muka langsung glowing mulus banget produk cepat resap bau sih turut comfy product manja muka xixiixi,5,Positive
"Dry, Medium, Warm",Usage Period : 6 months - 1 yearPurchase Point : Shopee,tahun maybe habis tinggal dikit alas ya ngaruh pakai efek buruk kayak sayang buang duit doang maaf ya pakai ngabisin doang biar sayang,3,Neutral
"Combination, Medium Dark, Neutral",Usage Period : 1 month - 3 monthsPurchase Point : XBeauty by Female Daily,serum skintific bikin kulit flawless tekstur lembut bikin kering hasil noticeable retinolnya bikin iritasi cocok mula retinol kulit kenyal poripori susut packagingnya oke harga reasonable recommended banget  skintific retinolserumreview,4,Positive
"Combination, Medium Light, Cool",Usage Period : 3 months - 6 monthsPurchase Point : Sociolla,suka banget pakai serum temu product skintific gentle retinol renewal serum kemas pump gampang bawa kemanamana tumpah efek lembap rawat kulit tanda tuan,5,Positive
"Combination, Dark, Neutral",Usage Period : 1 month - 3 monthsPurchase Point : Shopee,kulit kering produk cocok banget kulit kering kusam pori pori nonjol mata hidung kalo pakai tonjol kurang muka cerah tekstur kurang btw pakai moisturizernya nampol ceramide muka mulus pokok pakai kali minggu ya pakai tekstur muka,5,Positive
"Oily, Medium Light, Warm",Usage Period : 1 month - 3 monthsPurchase Point : Shopee,eh bentar iya tulis reference pribadi ya bagus kalo cocok teman teman asa pelembab doang maahhhhh ya lembab ya plumpy ngubah bikin tekstur muka baik biasssa ajaaah bad,3,Neutral
"Combination, Medium Light, Neutral",Usage Period : 1 week - 1 monthPurchase Point : Shopee,sok far bagus banget sih serum anti agingnya encapsulated retinol dalam pas pakai lengket bau sengat langsung serap kulit bikin kulit kenyal kepala cari serum anti aging hilang kerut garis garis halus wajah sih bintang,5,Positive
"Normal, Light, Cool",Usage Period : 1 month - 3 monthsPurchase Point : Shopee,beli paket moistnya diskon pakai sih sisa overall serum bagus tekstur watery gel cepat serap feels cekatcekit aroma tipis ganggu habis pakai wajah lembab kayak moistnya kurang packaging beda bentuk packagingnya pakai pump cocok tekstur serum cair plastik pumpnya mudah kelupas foto kelupas kadang hatihati suka tempel tangan serum pas pump lebih,4,Positive
"Dry, Medium Dark, Warm",Usage Period : 1 month - 3 monthsPurchase Point : Tiktok,serum pakai bareng moisnya efek sih serum booster nampol asa kayak lembab moisnya efek pakai retinol langsung efek glowingnya sih aku,1,Negative
"Dry, Light, Warm",Usage Period : 1 week - 1 monthPurchase Point : Shopee,kalo bilang ramah retinol bulshit pakai besok jidat luka kayak kulit kelupas merah perih sih kaget ngapa kapai ngeri retinol semalem habis pakai banyak pakenya wkwk jangka pakai minggu tonerku aman aneh aneh banyak wkwk kapok deh entar kalo pakai dikit butir diratain muka efek psikis takut kalo pakai efek anti aging nanem takut alam seram,1,Negative
"Combination, Light, Neutral",Usage Period : 1 month - 3 monthsPurchase Point : PR Package,klaim timereleased technology cepat efektif timbul iritasi aman lu skin barrier rusak kulit sensitif lawan garis halus kerut hasil signifikan minggu pakai kembali elastisitas encang jaga skin barrier kunci kelembabankulit halus kencang ingredients encaptulated retinol retinol retinal hydoroxypinacolone retinoate kali ceramides ns ng npap eop peptides gabung maytixyl peptide skn ake peptide acetyl tetrapeptide niacinamide dipotassium glycyrrhizate sodium hyaluronate centella asiatica ext tocopheroletc notable effect antiaging antioxidant antiacne brightening soothing hydrating note paraben alcohol sls mineral oil fragrance silicone fungal acne safe bpom skin type cara pakai pump malam design simple dominasi warna gold lengkap dus plastik bungkus produk botol kaca tebal aplikator airless pump tekstur gel watery bening bulir gold mudah rata cepat serap lengket ringan nyaman efek ademin lembabin kulitada wangi floral alergi tingling burning cekat cekit gatel perih efek rasa bikin kulit adem kenyal halus lifted cerah kusam esok hari asa halussehat plumpy kenyal glowing cerah pakai bantu banget memperbaikin kulit gradakan habis mens bantu rawat jerawat ngempesin pudar bekas jerawat utus jerawat jarang muncul minim banget tekstur kulit kasar kulit gampang minyak oil control bikin keringpecah pori soft samar gentle mudah terima kulit cocok lu mula note test patch coba kali minggu pakai daily exfo product kalo pakai selang seling ya rasa hydrate pakai produk hydrating layering wajib sunscreen,5,Positive
"Combination, Medium, Warm",Usage Period : Less than 1 weekPurchase Point : Shopee,retinol ajaib banget fisrt impress pakai malam takjub banget malam wajah shinning shimering alias glowing bulan cerah muka enjoy pakai beli,5,Positive
"Combination, Light, Cool",Usage Period : Less than 1 weekPurchase Point : Shopee,serum satu gentle kulit sensitif kandung bagus bangett jerawat cepat kering bekas jerawat pudar banget pori besih pokok oke banget sih produk cuman sayang susah banget cari dengar discontinue launch pakai,5,Positive
"Combination, Medium Light, Neutral",Usage Period : 6 months - 1 yearPurchase Point : Shopee,retinol cocok mula kandung retinol ringan mula cekat cekit perih bantu kulit lembab halus plumpy,5,Positive
"Normal, Medium Light, Neutral",Usage Period : 1 month - 3 monthsPurchase Point : Shopee,retinol cocok skintific pagi pas bangun wajah kering lembab ngurangin kerut sih kulit cerah pakai bulan pas pakai enak bulir,5,Positive
"Oily, Medium, Neutral",Usage Period : 3 months - 6 monthsPurchase Point : Shopee,pakai retinol kulit kering kelupas coba cari retinol gentle coba skintific gentle retinol pakai minggu kali aman banget kulit kelupas kering kulit sekar serasa halus glowing mulus jerawat bulan garis halus pudar pas pakai rasa panas nambahin pelembab muka,5,Positive
"Combination, Medium Light, Neutral",Usage Period : Less than 1 weekPurchase Point : Shopee,salah revie mesti vit sih retinol ngapusnya bijimane ya hapus bingung akutu salah kamar eui ya kalo review kudu karakter nih gue ketik penuh karakter sekian terima gaji,3,Neutral
"Oily, Medium Light, Neutral",Usage Period : 3 months - 6 monthsPurchase Point : Instagram,retinol bulan produk cocok coba retinol retinolnya skintific timbul cekat cekit wajah muka beruntusancocokuntuk serum skintific malam esok hari muka tenang,5,Positive
"Combination, Medium, Neutral",Usage Period : 6 months - 1 yearPurchase Point : Shopee,bucin moisturizernya penasaran sih serum cocok asa beda efek signifikan kalo duoin teksture wangi kental kayak sih moisturizer hasil pakai series kulit asa kenyal lembab minyak beruntus jarang,5,Positive
"Combination, Light, Neutral",Usage Period : 1 month - 3 monthsPurchase Point : Shopee,packagingnya oke tutup gampang retak kalo jatuh longgar rekomen pakai rasa efek signifikan pakai rutin tekstur suka mudah serap,2,Negative
"Combination, Medium, Neutral",Usage Period : 3 months - 6 monthsPurchase Point : Shopee,produk skintific kecewa skintific gentle retinol renewal serum cocok banget coba pakai retinol produk bikin kulit kering pokok cocok banget mula,5,Positive
"Normal, Light, Neutral",Usage Period : 6 months - 1 yearPurchase Point : Shopee,product retinol aman buat bikin efek negatif sih kulit gel bulir emas encapsulated kali ya enak banget asih efek plumpy esok hari gentle banget ya cocok mula habis botol beli ml moistnya ml,5,Positive
"Oily, Medium Light, Neutral",Usage Period : 1 month - 3 monthsPurchase Point : Tiktokshop,tekstur cair cepat resap kulit sih bikin cekat cekit pakai malemnya pakai jamin tekstur kulit wajah lenyap benerbener langsung halus komedo beruntus habis pakai deh kenal komedo beruntus lupa pagi pakai sunscreen ya ,5,Positive
"Dry, Medium, Neutral",Usage Period : 3 months - 6 monthsPurchase Point : Shopee,kali pakai retinol takut coba nya pilih retinol gentle kayak skintific pakai febuari kemarin minggu ngefek banget muka glowing komedo ku kurang banget jxb banget repurchase skintific retinol ribu itu botol botol,5,Positive
"Dry, Medium, Neutral",Usage Period : 1 month - 3 monthsPurchase Point : Shopee,serum retinol pertama klaim sensitive skin friendly berani coba pakai jujur teman notice kulit glowing samar fine les ya pakai botol hihihi merah parah worth try pokonyaaa,5,Positive
"Dry, Medium, Warm",Usage Period : 1 month - 3 monthsPurchase Point : Shopee,retinol pakai turut efek dirasain ya cuman kalo pakai pas malam pagi bangun bangun kulit kenyall lembab efek negatif kulit coba retinol,5,Positive
"Dry, Light, Warm",Usage Period : 1 month - 3 monthsPurchase Point : Shopee,basenya air enak banget cepat serap kulit wangi soft banget kulit langsung lembut cerah dipakenya malam kalo besok pagi rasa segerrr kulit lembab efek kulit halus cerahh sih,5,Positive
"Combination, Medium, Warm",Usage Period : 6 months - 1 yearPurchase Point : Tokopedia,beli bundling tube jar isi sih tekstur watery mending tube kayak biar gampang dipakenya enak pakai gampang ngeblend pagi muka mulus deh enak lembab gentle ya gatakut makenya,5,Positive
"Oily, Medium Light, Warm",Usage Period : 1 week - 1 monthPurchase Point : tiktok shop,serum gentle mula sih nyaman bikin kulit pas bangun tidur tuh haluuuuus lembut tekstur gel butir kecil pas rata wajah satu kulit wangi ganggu sih cepat habis pakai malam oh iya pakai malam kandung gentle kalo pakai kali minggu hasil kulit halus lembut kering kalo jerawat gede lumayan ngaruh bikin kempes sayang jerawat orang tipe beruntus ngefek sih pakai overall mula pakai retinol wajib coba pakai retinol kaya nendang sih,4,Positive
"Combination, Medium, Warm",Usage Period : More than 1 yearPurchase Point : Shopee,beli paket ya moisturizer nya review ku moisturizer nya bikin kulit lembab banget halus kenyal ya kulit wajah sehat bersih ngalamin iritasi harga lumayan ya pintar hemat produk nya sih pakai botol ya pelit retinol pakai,5,Positive
