Skin Type,Usage Periode,Review,Rating,Label
"Combination, Medium Light, Neutral",Usage Period : 3 months - 6 monthsPurchase Point : Tokopedia, ml  idr  st retinol retinol hgkan teman sih cinta skincare makeup dokter saran produk mula retinol pakai tapi efek kali pakai asa banget kulit haluss wow packagingnya cantik elegan mungil yet sturdy pumpnya lock system aman bawa travelling dipakein suami aman efek samping,5,Positive
"Dry, Medium Light, Neutral",Usage Period : 3 months - 6 monthsPurchase Point : Shopee,first retinol umur pengin anti aging kayak orangorang taraaa retinol pertama diri takuttakut pakeknya pas awalawal pakai metode sandwich kulit anteng minggu coba langsung bare skin timpa moisturizer cekat cekit besok toleransi empty nih pakenya pea size habis pengin kelas adapele takdir jodoh amin,5,Positive
"Oily, Medium Dark, Neutral",Usage Period : More than 1 yearPurchase Point : Shopee,benerbener comfort skincare sih maju mundur pakai retinol first timer retinol cocok brand putus pakai aman damai langsung cocok  benerbener anti aging ampuh ,5,Positive
"Combination, Medium Light, Neutral",Usage Period : Less than 1 weekPurchase Point : Brand website,coba retinol baik sih somethinc kulit kenyal halus muncul jerawat bruntusan pakai pagi nya kering kulit kayak mochi repuchase sih pengin coba granative nya sebenrnya,5,Positive
"Combination, Medium Light, Cool",Usage Period : 6 months - 1 yearPurchase Point : Tokopedia,pakai kenal retinol kulit pas tahap banget pakai minggu pakai pump lipat hidung ketrigger sensitivity nya merah kulit heboh tebal layer efek bagus sih kayak ngaruh komedonya kurang jerawat pms nya rajin muncul,4,Positive
"Dry, Medium, Neutral",Usage Period : 6 months - 1 yearPurchase Point : tiktok,beli ya kerut mata wajah kusam pakai mama usia banget kerut jidat pipi tua jarang awat pakenya layering sih pakai moisturizer retinol diamond moisturizer kadang ya lamalama langsung moisturizer pakai retinol kadang pakai diamondnya surprisingly kerut kurang kencang sehat banget mama senang banget request repurchase,5,Positive
"Dry, Medium Light, Neutral",Usage Period : 1 week - 1 monthPurchase Point : Shopee,sok far sok good efek negatif pakai almost kulit kering aman pakai bikin cekit rutinin pakai retinol habis biar hasil hihi,5,Positive
"Dry, Medium Light, Neutral",Usage Period : 1 month - 3 monthsPurchase Point : Shopee,tekstur creamy warna cream pas pakai cekatcekit aman mula finishnya minyak muka asa lembab jerawat bekas nampol sok far efek rasa lembab next coba serum retinol kali pakai retinol somethinc granactive retinoid botol ungu dua asih efek signifikan,3,Neutral
"Oily, Medium, Cool",Usage Period : More than 1 yearPurchase Point : Shopee,efek sih banget besok pagi ya sayang malas skincarean malam tampak efek kalo rutin pakai hasil maksimal ngelembabin tekstur kalo oles lengket,5,Positive
"Normal, Medium, Warm",Usage Period : 3 months - 6 monthsPurchase Point : Shopee,somethinc level encapsulated retinol retinol cocok banget mula kandunganretinolnya manfaat samar tandatanda tua bonus cerah tekstur milky warna putih cepat resap lengket packagingnya serum somethinc repurchase orang think yes ratingnya,4,Positive
"Combination, Medium, Warm",Usage Period : Less than 1 weekPurchase Point : Shopee,beli retinol somethinc discount ecommerce coba retinol somethinc level retinol suka susah cari coba suka encapsulated melembabkan tunggu ngeset kayak tekturnya cair gampang resap pakai wajah plump kerut lihat kerut wajah,4,Positive
"Combination, Medium, Neutral",Usage Period : 3 months - 6 monthsPurchase Point : Lazada,packing produk kaca hati ya naruhnyaa aplikatornya mudah banget pump tekstur cair mudah resap kulit wangi anehh sebel kadang tuh suka misah loh inggrediens nya kalo pakai kocok biar pas luat nyatuu,4,Positive
"Combination, Medium Light, Neutral",Usage Period : More than 1 yearPurchase Point : Shopee,serum retinol terdebest coba coba retinol merek korea lokal harga affordable hasil muas bekas jerawat cepat kering minggu pakai kali bikin breakout kalo repurchase botol pakai trial somethinc pure retinol moga cocok btw recomended ya coba pakai retinol bikin break serum somethinc aman kulit trial takut kulit breakout,5,Positive
"Combination, Medium, Neutral",Usage Period : Less than 1 weekPurchase Point : Shopee,main ingredientsnya encapsulated retinol golong mild less irritation squalane moisturizing kulit hyaluronic acid hidrasi melembabkan karena produk anti aging pakai usia claimnya tekstur kental warna putih tulang kental manis pump spreadnya bagus jangkau area wajahbuatku feelsnya pakai moisturizer versi light bikin tarik unscented aman sensitive scentskin concernnya skin type kulit dry super dry sensitive suka feels sometimes kulit combi overmoist area dry patch bagus bangetjangan campur exfoliant aha bha pha acid aman kalo layer niacinamide kandung cicahoneyisinya ml spreadnya bagus turut boros packagingnya airless pump,4,Positive
"Normal, Light, Neutral",Usage Period : Less than 1 weekPurchase Point : Shopee,besttt serummmmm pokok solusi masalah kulit terksturnya enakkkk banget bikin jerawat cepat kering kulit halus packaging bagus higienis pokok reccomended must haveee worth buy pokok,5,Positive
"Dry, Medium Light, Neutral",Usage Period : 1 week - 1 monthPurchase Point : shopee,maaf cocok kayak kulit sensitif retinol retinol rangkai merk apa wajah bikin kucel kusam idh pakai sunscreen pagi nya cocok cocok pakai coba sayang cocok,3,Neutral
"Normal, Medium Dark, Neutral",Usage Period : 1 month - 3 monthsPurchase Point : Lazada,beli gara gara sachet kemas botol bikin kulit sehat plumpy pakainyaaa bekas jerawat hitam cepat mudar pori pori lumayan kecil pakai nya repurchase,5,Positive
"Dry, Medium, Neutral",Usage Period : More than 1 yearPurchase Point : Shopee,tahun pale retinol somethinc cocok aman banget kulit wajah pakai nya rutin minggu kali tekstur kental serap cepat kulit wajah bangun pagi kulit asa segar cerah bikin pori kecil pengin coba retinol aman ku somethinc retinol jadi opsi,5,Positive
"Combination, Medium, Warm",Usage Period : 6 months - 1 yearPurchase Point : Official Brand Store,serum retinol coba pakai retinol otw  jujur pakai asa ubah signifikan banget bikin kulit plumpy efek muka taapi masuk asa kerut dahi pudar perlahan hilang canggih oiya breakout purging gacocok pakai produk kasih serum besok kulit langsung tenang sih jiwit ngempes,5,Positive
"Combination, Medium, Warm",Usage Period : 1 week - 1 monthPurchase Point : Shopee,serum retinol terlembab coba packagingnya botol kaca warna hijau aplikator pump tekstur milky cair ampir aroma pas baurin muka cepat resap kasih efek instant plumping glowing asa pakai serum retinol cekat cekit kering kering kulit muka beginner friendly sekaliii pasti pakai bikin breakout kulit muka asa kenyal bantu kontrol minyak moga promo ya repurchase sih,5,Positive
"Combination, Medium Light, Warm",Usage Period : 1 month - 3 monthsPurchase Point : Shopee,waswas pakai produk retinol takut cocok breakout coba produk suka banget retinol harsh tekstur creamy minyak pakai teknik sandwich pakai sesuai atur tuh bikin iritasi melembabkan jerawat cepat matang bekas kurang cepat skinbarier oke aman pakai,5,Positive
"Combination, Medium, Neutral",Usage Period : 3 months - 6 monthsPurchase Point : Watson,produk serum retinol nya somethinc oke cocok kulit ku tekstur nya kental warna kuning cepat resap kulit sih bikin lengket pakai malam besok nya kulit wajah plumpy halus cerah worth buy,5,Positive
"Normal, Medium Light, Neutral",Usage Period : 3 months - 6 monthsPurchase Point : Shopee,turut retinol cocok mula pertamakali pemakaiaan purging perih kulit suka bikin kulit glowing jarang jerawat cuman pakai,5,Positive
"Normal, Medium Dark, Warm",Usage Period : 3 months - 6 monthsPurchase Point : Laris,bikin kulit wajah plumpy halus minim jerawat cerah pakai malam tekstur cair layak serum parfum harap wangi serum resap sabar apply nya imbang rajin pakai sunscreen imbang pakai sunscreen bikin kulit bruntusan kusam lupa pakai moisturizer banget beda kondisi kulit wajah tingkat puji suami,5,Positive
"Combination, Medium Light, Neutral",Usage Period : More than 1 yearPurchase Point : Shopee,retinol turut cocok mula pakai produk repurchase berkalikali pas pakai bikin kering benerbener well hydrated kalo layer serum efek rutin pakai kulit halus plumpy bikin cerah kalo layer serum niacinamide perfect combo,5,Positive
"Combination, Medium Light, Warm",Usage Period : 1 week - 1 monthPurchase Point : TiktokShop,kali coba pakai retinol ragu ragu minggu pakai effect buruk lumayan rasa kulit pori pori lumayan kecil kulit halus,5,Positive
"Combination, Medium Light, Neutral",Usage Period : 3 months - 6 monthsPurchase Point : Shopee,kali coba retinolnya somethinc efek negatifbreakout pas bangun tidur kulit lembab banget retinolnya somethinc banget resap kulit butuh hasil hasil signifikan banget cepat hilang jerawat bikin glowing,4,Positive
"Normal, Light, Neutral",Usage Period : 3 months - 6 monthsPurchase Point : Instagram,retinol bulan produk cocok coba retinol retinolnya somethinc timbul cekat cekit wajah muka beruntus cocok serum somethinc malam esok hari muka glowing kencang,5,Positive
"Combination, Light, Cool",Usage Period : 1 month - 3 monthsPurchase Point : Shopee,butuh kandung retinol faktor umur pakai jarang jarang minggu coba retinol merk efek bikin kulit sehat pakai produk retinol kulit breakout jerawat batu muncul tau sih efek retinolnya kandung pakai jerawat kulit terhidasi plumpy jujur bingung reaksi produk kulit,3,Neutral
"Combination, Light, Neutral",Usage Period : Less than 1 weekPurchase Point : Shopee,kali beli produk retinol pakai serum somethinc bikin jerawat kayak cocok biasa malas pakai serum prefer pakai bakuchiol oilnya somethinc,3,Neutral
"Combination, Medium, Neutral",Usage Period : 1 month - 3 monthsPurchase Point : Beautyhaulindo,beginner friendly coba pakai retinol kulit sensitif pakai serum tekstur kulit wajah halus botol pumpnya ok solid tekstur watery little thick gampang resap overall good,5,Positive
"Normal, Medium, Neutral",Usage Period : 1 month - 3 monthsPurchase Point : Shopee,retinol alam milia akh hilang botol pakai menghilanh kecil botol hilang milia mata sulit yuk coba tau kali cocok senang pakai produk hasil muka beli sih,5,Positive
"Normal, Medium, Neutral",Usage Period : 6 months - 1 yearPurchase Point : Shopee,satu serum retinol pakai bulan suka nyaman pakai retinol breakout purging hasil mantul banget juara somethinc bikin serum reurchase,5,Positive
"Dry, Medium Light, Cool",Usage Period : More than 1 yearPurchase Point : XBeauty by Female Daily,retinol baik mula ringan gentle cocok skin stype guna retinol gunakkan toner moist trlbh lanjut serum ubah mnggu hilang jerawat samar noda hitam bekas flek super highly recommend,5,Positive
"Oily, Medium, Neutral",Usage Period : 3 months - 6 monthsPurchase Point : Shopee,beli racun teman claimnya serum retinol aman mula tekstur thick ya kental warna putih susu kuning bau khas retinol perfume finishnya lengket bikin wajah glowing pagi hari,5,Positive
"Oily, Medium Light, Warm",Usage Period : 3 months - 6 monthsPurchase Point : Shopee,lumayan suka kaya produk retinol coba first timer cobacoba takut kalo efek bikin kulit gentle pemulaaa sih recommended,5,Positive
"Oily, Medium Light, Neutral",Usage Period : 1 week - 1 monthPurchase Point : Gift,retinol ajaib sih kulit wajah komedokomedo kayak hempas efektif hilang komedo dibandingin aha bha pakai cekitcekit pas pakai malam pakai besok kulit wajah halus bersih cerah wangi enak ya kayak obat papa tolerir,5,Positive
"Combination, Light, Neutral",Usage Period : 1 month - 3 monthsPurchase Point : Gift,produk hibah teman cocok tekstur oily serap kulit gersang kulit hehe buts okaay greasy sih pakai pas muka lembab versi retinol aman encapsulated seirritan retinol bulan pakai malam bekas jerawat ku pudar tekstur alus secepet retinol lagilagi encapsulated kerja sih repurchase nampol jelek ya,4,Positive
"Oily, Medium, Neutral",Usage Period : 3 months - 6 monthsPurchase Point : Whatsapp,serum retinol super gentle kulit tekstur kayak lotion lembut thick cair aroma sengat mudah diblend tingkat resap lumayan lembap rasa banget apply serum overall suka serum ,5,Positive
"Normal, Medium, Neutral",Usage Period : Less than 1 weekPurchase Point : Shopee,kali coba retinol sisa botol sih asa sih next coba retinol merk jujur pakai ngefek kulit sih gapapa coba harga mahal untung pas beli diskon sesak hahaha,4,Positive
"Dry, Medium, Neutral",Usage Period : More than 1 yearPurchase Point : Shopee,produk retinol bikin purging sih bikin kulit kencang efek lumayan cepat turut kerut kurang banget dahi smile les pakai minggu kali dikit dikit lumayan awet kandung ceramidesnya kalo salah skin loves,5,Positive
"Combination, Light, Cool",Usage Period : 3 months - 6 monthsPurchase Point : tiktok,bagus banget bikin kerut muka pudar muka halus banget plum glow komedo kurang instant yabutuh jerawat nongol langsung mateng beruntus hilang butuh love banget produk tau nemu kurang sesuai kandung kerjain mahal sih,5,Positive
"Combination, Medium Light, Neutral",Usage Period : More than 1 yearPurchase Point : Watson,years ago jerawat kelar skripsi makan iklan coba produk bikin jerawat ku parah coba pakai somethinc lihat beauty influencer hasil bagus ubah wajah banget banget jerawat jerawat bandel pokok somethinc retinol absen menu utama perskin careran  prnya mudarin bekass jerawat ,5,Positive
"Combination, Medium, Neutral",Usage Period : 3 months - 6 monthsPurchase Point : Shopee,pakai bagus kurang kerut pasca lahir kemarin tekstur kulit halus bagus pakai malam besok wajah halus lupa pakai sunscreen besok ya aroma enak sih nyengat,5,Positive
"Combination, Light, Neutral",Usage Period : 1 week - 1 monthPurchase Point : tiktok,kali coba retinol somethinc review bagus coba layer niacinamide pakai minggu pakai xminggu kulit wajah cocok timbul apa muka cerah sih hehehe garis halus ubah next kalo pakai lama review lagi,5,Positive
"Combination, Medium Light, Neutral",Usage Period : 1 month - 3 monthsPurchase Point : Lazada,coba retinol bulan butuh adaptasi awalnyaa bikin muka ku muncul jerawatt works bagus banget lamaa hasil tesktur wajahh ku halus dull skin lumayan dark spot,5,Positive
"Combination, Medium Light, Neutral",Usage Period : 6 months - 1 yearPurchase Point : kkv,truely madly deeply love serum inikareena muka jerawat takut pas coba benar muka bersih kendali jerawat pakein pelembab seram inibahkan toner papa kering muka,4,Positive
"Normal, Light, Neutral",Usage Period : 6 months - 1 yearPurchase Point : Shopee,coba produk ber retinol coba produk bagus baik tekstur kulit ku kecil pori sama kerut hilang milia  jujur enak banget sesuai claimnya repurchase kali saking neng coba produk retinol overall suka produk rekomendasi teman sih,4,Positive
"Oily, Medium Light, Neutral",Usage Period : 3 months - 6 monthsPurchase Point : Shopee,aaaaa retinol pertamakuu kali banget coba retinol pilih produk somethinc kali pakai retinol reaksi purging bersih ya keluar kotor wajah purging waspada purging cocok kalo purging mgg habis entar sembuh ganti kulit glowing sehat kulit asa kencang kendor hahah,5,Positive
"Combination, Medium Light, Neutral",Usage Period : 1 week - 1 monthPurchase Point : Shopee,lumayan coba bebepa serum retinol merk somethinc encapsulated retinol nya salah suka bikin iritasi bikin kering kerontang melembabkan kulit halus jarang jerawat texture serum enak cepat nyerap kulit pokok wajib coba retinol somethinc,5,Positive
"Combination, Medium, Neutral",Usage Period : 1 month - 3 monthsPurchase Point : Shopee,kalo coba retinol jarang ampuh kamau coba expert banget kandung retinol level plisss ngaruh banget kulit mula ya jujurly banget suka banget produk bagus kalo combi produk kandung niacinamide nya pkok nya best ya,4,Positive
"Dry, Medium, Warm",Usage Period : 3 months - 6 monthsPurchase Point : Tokopedia,serum retinol aman banget kulit kering sensitif definisi serum nyaman efek baik kulit isi ml pakai loh sangka pakenya selang seling exfo serum lupa layering hydrating serum nampol efek,5,Positive
"Combination, Light, Warm",Usage Period : 1 week - 1 monthPurchase Point : Tiktok shop,umur takut banget coba serum retinol dengar kalo retinol tuh kandung kuat takut muka cocok  eh beraniin beli coba pakai retinolnya somethinc kali pakai lmyn asa sih efek kulit kulit sekitar hidung tuh suka tekstur pakai asa halus update later ya pakai ,5,Positive
"Combination, Light, Cool",Usage Period : 1 month - 3 monthsPurchase Point : Lazada,retinol pertama pakai cekat cekit pakai minggu kali retinol bahan aktif sensitif hasil jarang banget muncul jerawat mens anti aging timbul efek negatif repurchase sih,5,Positive
"Combination, Medium Light, Cool",Usage Period : 1 week - 1 monthPurchase Point : Traditional market,retinol mnurutku melembabkan kulit wajah bangun tidur pagi basuh air wajah bersih alus cocok sih coba retinol harga bawah kalo bagus entar hehe,5,Positive
",25 - 29",Usage Period : 1 week - 1 monthPurchase Point : Shopee,kulit sensitif benar cocok hiksssss maaf pas pakai panas merah coba kali pakai reaksi wajah cocok sih,2,Negative
"Oily, Medium Light, Warm",Usage Period : 3 months - 6 monthsPurchase Point : Shopee,skeptis nya blend retinol turns really good tekstur semi emulsion cepat nyerap minyak kulit gampang pakai sandwich method aman pakai produk efek samping kering iritasi merah tekstur kulit cerah halus pakai you re looking beginner friendly retinol highly recommend try one,4,Positive
"Oily, Medium Dark, Neutral",Usage Period : More than 1 yearPurchase Point : Shopee,pakai versi dropper ngaruh makenya konsisten konsisten foto minggu hasil bulan banget beda bekas jerawat pudar merah kurang tekstur baik jaaaaaarang banget jerawat rasa pas kota minggu bawa retinol muka kayak kusam jerawat dikit sih retinolnya somethinc ngaruh banget kulit minus finishnya sih bikin muka lengket minyak kayak nyerap tekstur cocok coba retinol,4,Positive
"Dry, Medium Light, Warm",Usage Period : 1 month - 3 monthsPurchase Point : PR Package,beauty class salah store bekas brand sponsor utama something gift serum juara lumayan putus pakai serum bagus cocok dia pakai malam itu minggu minggu sekitranya cerah pakai besok nya cerah lembut,5,Positive
"Oily, Medium, Neutral",Usage Period : 1 month - 3 monthsPurchase Point : Shopee,retinol harga nya affordable efek ya ya aman purging cocok pas jerawat aman ya wow hasil nya kulit repurchase kaya mikir sih,4,Positive
"Combination, Medium Light, Neutral",Usage Period : 3 months - 6 monthsPurchase Point : Shopee,first time trying retinol it s brand skeptis perretinolan i m really following trend serum ngaruh muka regularly using month definitely sih lot improvement skin jerawat hairline hilang tumbuh tekstur muka improve smooth works amazing skin,5,Positive
"Dry, Medium Light, Neutral",Usage Period : 3 months - 6 monthsPurchase Point : Shopee,retinol bagus banget mula formulasi nya gentle bikin kulit iritasi cocok tekstur nya kental warna kuning mudah serap feeling oily ngeganggu wangi bantu samar garis senyum muncul pakai bulan pakai malam,5,Positive
"Oily, Medium, Warm",Usage Period : More than 1 yearPurchase Point : Shopee,tekstur cair kental warna kuning mudah serap lengket melembabkan kulit tekstur suka kali launching oil wangi subtle tipis ganggu packaging suka banget bentuk pump upgrade versi pakai dropper efektivitas kulit level mula butuh sabar konsistensi hasil maksimal iritasi harga affordable angka ribu ya pintarpintar cari diskon,5,Positive
"Combination, Medium Light, Neutral",Usage Period : 3 months - 6 monthsPurchase Point : Instagram,ngaruh makan iklan kaya kulit ketua kali ya pakai cuman pakai sebentar dilanjutin however efek jelek apaapa sih cobacoba pakai retinol coba,3,Neutral
"Combination, Light, Neutral",Usage Period : 1 month - 3 monthsPurchase Point : Female Daily Event,kemas botol pump higienis teskturnya light lotion warna kuning kandung retinolnya mild cekitcekit kondisi kulit wajah kering bulan pakai produk lumayan cepat kempes jerawat bikin kulit moist pakai kali minggu seling toner kandung aha,5,Positive
"Normal, Medium Light, Neutral",Usage Period : Less than 1 weekPurchase Point : Shopee,kali coba rasa lembab enak mu pas pagi muka kering break parah jerawat banget salah pakai cocok pakai sih tahu,3,Neutral
"Combination, Medium, Neutral",Usage Period : 3 months - 6 monthsPurchase Point : Shopee,kulit biasa retinol gue produk nampol alam pakai retinol serum fss avoskin hasil nampol banding somethinc bilang mild banget recommended kali coba retinol packaging cakep sih,4,Positive
"Oily, Medium Dark, Warm",Usage Period : 1 week - 1 monthPurchase Point : PR Package,beda produk mana botol kaca transparant hijau dropper warna dop hijau pump aman jaga stabilitas produk hygyne botol pump tektur lotion milky stabil bening mudah berubahoxidize lembab nya gentle reformulasi tambah squalene ngaruh bikin lembab khusunya beginer retinol serum bantu samar kerut halus encang kulit jaga remaja kenyal mana kulit halus plumpy advance user pakai pagi malam retinol gentle,4,Positive
"Combination, Light, Warm",Usage Period : 6 months - 1 yearPurchase Point : Tokopedia,turut kalo cari banget pakai retinol damn pilih pakai berat kulit tipe wateryeasy absorb pokok enak kulit important efek pakai jangka panjang keren turut muka tend bikin kulit glowing hilang blemishes love product ,5,Positive
"Dry, Medium Light, Cool",Usage Period : More than 1 yearPurchase Point : Shopee,suka banget serum retinol somethinc cocok produk somethinc jerawat langsung kering pakai maleman pakai tekturnya cair tektur kental banget hasil pas muka break,5,Positive
"Combination, Medium Light, Neutral",Usage Period : 1 month - 3 monthsPurchase Point : Tik Tok,pengin pasuk retinol skin cycling routine pilih retinol kali coba jenis encapsulated retinol baca informasi jenis tuh gentle perih pas awalawal pakai muncul jerawat dagu kira kayak sih purging biasa kandung warna asli serum putih susu tekstur kentel sesuai fungsi regenerasi kulit wajah cepat bekas jerawat cepat pudar coba serum somethinc sih bakuchiol oil serum somethinc hasil bagus sih retinol beli retinol somethinc naikin level pure retinol,4,Positive
"Combination, Medium Dark, Neutral",Usage Period : 1 month - 3 monthsPurchase Point : XBeauty by Female Daily,kali alam serum retinol produk ragu coba retinol teman rekomenin coba produk gentle itu suka banget packagingnya always ya travel friendly banget tekstur bilang kental aroma tipis banget kulit aman kombinasi tonermois produk,5,Positive
"Oily, Medium, Cool",Usage Period : 1 week - 1 monthPurchase Point : Sociolla,kali pakai wajah langsung jerawat review jelek sabarsabarin ilangin jerawat baca tonton review serum pakai hydrating serum krim jerawat sembuh coba pakai hydrating serum amanaman hasil wajah tuh pakai malam pagi muka mulus coba pas jerawat telah layer serum acne andal brand kempes besok nya holy grail jerawat peeling serum nya somethinc layer serum acne overall bagus pengin repurchase kalo beli salah pilih beli peeling serum nya works banget wajah oily kadang jerawat,4,Positive
"Combination, Medium, Neutral",Usage Period : 1 month - 3 monthsPurchase Point : Shopee,tekstur kental sebenarnyaoke bulan mudah oksidasi keruh punya bau dikit menganggu taroh suhu ruang kena sinar matahari pas pakai muka kering kelupas makeknya minggu cocok kulit,3,Neutral
"Combination, Medium, Neutral",Usage Period : 1 month - 3 monthsPurchase Point : Tokopedia,klaim retinol serum pakai mula tekstur cair kental warna kuning keruh pakai kali minggu habis sayang habis botol kulit tau botol cocok jerawat kunjung sembuh kulit kering pakai metode sandwich bareng hydrating product repurchase surely no,3,Neutral
"Oily, Light, Cool",Usage Period : Less than 1 weekPurchase Point : Shopee,idk takes long try product beli coba huhuhuhu kalo takstur bau standar kayak produk retinol funky smell warna putih gading kental first time pakai muka pakai metode sandwich hamdalah cekit cekit pagi loh kulit langsung asa mulus kayak jalan tol ,5,Positive
"Oily, Medium, Warm",Usage Period : 3 months - 6 monthsPurchase Point : Shopee,coba somethinc serum retinol kesan pas malam pakai pagi wajah cerah kenyal wajah lembab enak wajah  bulan pakai keluh negatif muncul wajah sih ya bikin iritasi timbul jerawat cepat bikin bruntusan jerawat reda sih suka  eiya wangi enak repurchased yes,5,Positive
"Oily, Medium, Cool",Usage Period : 1 week - 1 monthPurchase Point : Sample,retinol serum tekstur rada kentelagak creamy suka deh tekstur retinol bikin kulit kering malahaan rasa lembab kamar tandatanda oksidasi seri serum dulukan mudah oksidasi good tingling drama breakout pakai retinol pagi nya kulit muka kilau lembab plumpy tarik sih purchase full size nya,4,Positive
"Normal, Medium, Warm",Usage Period : 1 month - 3 monthsPurchase Point : Shopee,mrlenurutku best retinol serum level harga efek kayak serum retinol mahal tekstur cair fragrance gampamg diblend pump nya bagus bikin muncrat mana pakai malam dark spots kurang kulit segar,5,Positive
"Dry, Medium Light, Warm",Usage Period : 1 month - 3 monthsPurchase Point : Shopee,retinol dua pakai kali minggu bagus lumayan hilang bekas jerawat rajin pakai sunscreen pakai produk brightening niacinamide vit sih pakai rutin hasil instan mula coba serum bakuchiolnya pakai retinol tes cocok oles telinga kali sih aman wajah,4,Positive
"Combination, Medium, Neutral",Usage Period : 1 month - 3 monthsPurchase Point : Shopee,kali pakai retinol tau atur banget pakai malam mula kali minggu minim banget tahu skincare untung efek buruk sih muka glowing cerah banget bekas jerawat cepat hilang mulus pokok pakenya layer niacinamidenya sabi beet stop pakai retinol breakout tau purging berani pakai jujur retinol bagus banget gentle kulit,5,Positive
