Skin Type,Usage Periode,Review,Rating,Label,cleaned_review
"Combination, Medium Light, Cool",Usage Period : 6 months - 1 yearPurchase Point : Tokopedia,pakai kenal retinol kulit pas tahap banget pakai minggu pakai pump lipat hidung ketrigger sensitivity nya merah kulit heboh tebal layer efek bagus sih kayak ngaruh komedonya kurang jerawat pms nya rajin muncul,4,Positive,kenal retinol kulit pas tahap minggu pump lipat hidung ketrigger sensitivity nya merah kulit heboh tebal layer efek bagus sih ngaruh komedonya jerawat pms nya rajin muncul
"Dry, Medium, Neutral",Usage Period : 6 months - 1 yearPurchase Point : tiktok,beli ya kerut mata wajah kusam pakai mama usia banget kerut jidat pipi tua jarang awat pakenya layering sih pakai moisturizer retinol diamond moisturizer kadang ya lamalama langsung moisturizer pakai retinol kadang pakai diamondnya surprisingly kerut kurang kencang sehat banget mama senang banget request repurchase,5,Positive,beli kerut mata wajah kusam mama usia kerut jidat pipi tua jarang awat pakenya layering sih moisturizer retinol diamond moisturizer kadang lamalama langsung moisturizer retinol kadang diamondnya surprisingly kerut kencang sehat mama senang request repurchase
"Dry, Medium Light, Neutral",Usage Period : 1 week - 1 monthPurchase Point : Shopee,sok far sok good efek negatif pakai almost kulit kering aman pakai bikin cekit rutinin pakai retinol habis biar hasil hihi,5,Positive,sok far sok good efek negatif almost kulit kering aman cekit rutinin retinol habis biar hasil hihi
"Dry, Medium Light, Neutral",Usage Period : 1 month - 3 monthsPurchase Point : Shopee,tekstur creamy warna cream pas pakai cekatcekit aman mula finishnya minyak muka asa lembab jerawat bekas nampol sok far efek rasa lembab next coba serum retinol kali pakai retinol somethinc granactive retinoid botol ungu dua asih efek signifikan,3,Neutral,tekstur creamy warna cream pas cekatcekit aman finishnya minyak muka asa lembab jerawat bekas nampol sok far efek lembab next coba serum retinol retinol somethinc granactive retinoid botol ungu asih efek signifikan
"Oily, Medium, Cool",Usage Period : More than 1 yearPurchase Point : Shopee,efek sih banget besok pagi ya sayang malas skincarean malam tampak efek kalo rutin pakai hasil maksimal ngelembabin tekstur kalo oles lengket,5,Positive,efek sih besok pagi sayang malas skincarean malam efek kalo rutin hasil maksimal ngelembabin tekstur kalo oles lengket
"Normal, Medium, Warm",Usage Period : 3 months - 6 monthsPurchase Point : Shopee,somethinc level encapsulated retinol retinol cocok banget mula kandunganretinolnya manfaat samar tandatanda tua bonus cerah tekstur milky warna putih cepat resap lengket packagingnya serum somethinc repurchase orang think yes ratingnya,4,Positive,somethinc level encapsulated retinol retinol cocok kandunganretinolnya manfaat samar tandatanda tua bonus cerah tekstur milky warna putih cepat resap lengket packagingnya serum somethinc repurchase orang think yes ratingnya
"Combination, Medium, Warm",Usage Period : Less than 1 weekPurchase Point : Shopee,beli retinol somethinc discount ecommerce coba retinol somethinc level retinol suka susah cari coba suka encapsulated melembabkan tunggu ngeset kayak tekturnya cair gampang resap pakai wajah plump kerut lihat kerut wajah,4,Positive,beli retinol somethinc discount ecommerce coba retinol somethinc level retinol suka susah cari coba suka encapsulated melembabkan tunggu ngeset tekturnya cair gampang resap wajah plump kerut kerut wajah
"Combination, Medium, Neutral",Usage Period : 3 months - 6 monthsPurchase Point : Lazada,packing produk kaca hati ya naruhnyaa aplikatornya mudah banget pump tekstur cair mudah resap kulit wangi anehh sebel kadang tuh suka misah loh inggrediens nya kalo pakai kocok biar pas luat nyatuu,4,Positive,packing kaca hati naruhnyaa aplikatornya mudah pump tekstur cair mudah resap kulit wangi anehh sebel kadang tuh suka misah loh inggrediens nya kalo kocok biar pas luat nyatuu
"Combination, Medium Light, Neutral",Usage Period : More than 1 yearPurchase Point : Shopee,serum retinol terdebest coba coba retinol merek korea lokal harga affordable hasil muas bekas jerawat cepat kering minggu pakai kali bikin breakout kalo repurchase botol pakai trial somethinc pure retinol moga cocok btw recomended ya coba pakai retinol bikin break serum somethinc aman kulit trial takut kulit breakout,5,Positive,serum retinol terdebest coba coba retinol merek korea lokal harga affordable hasil muas bekas jerawat cepat kering minggu breakout kalo repurchase botol trial somethinc pure retinol moga cocok btw recomended coba retinol break serum somethinc aman kulit trial takut kulit breakout
"Combination, Medium, Neutral",Usage Period : Less than 1 weekPurchase Point : Shopee,main ingredientsnya encapsulated retinol golong mild less irritation squalane moisturizing kulit hyaluronic acid hidrasi melembabkan karena produk anti aging pakai usia claimnya tekstur kental warna putih tulang kental manis pump spreadnya bagus jangkau area wajahbuatku feelsnya pakai moisturizer versi light bikin tarik unscented aman sensitive scentskin concernnya skin type kulit dry super dry sensitive suka feels sometimes kulit combi overmoist area dry patch bagus bangetjangan campur exfoliant aha bha pha acid aman kalo layer niacinamide kandung cicahoneyisinya ml spreadnya bagus turut boros packagingnya airless pump,4,Positive,main ingredientsnya encapsulated retinol golong mild less irritation squalane moisturizing kulit hyaluronic acid hidrasi melembabkan anti aging usia claimnya tekstur kental warna putih tulang kental manis pump spreadnya bagus jangkau area wajahbuatku feelsnya moisturizer versi light tarik unscented aman sensitive scentskin concernnya skin type kulit dry super dry sensitive suka feels sometimes kulit combi overmoist area dry patch bagus bangetjangan campur exfoliant aha bha pha acid aman kalo layer niacinamide kandung cicahoneyisinya ml spreadnya bagus boros packagingnya airless pump
"Normal, Light, Neutral",Usage Period : Less than 1 weekPurchase Point : Shopee,besttt serummmmm pokok solusi masalah kulit terksturnya enakkkk banget bikin jerawat cepat kering kulit halus packaging bagus higienis pokok reccomended must haveee worth buy pokok,5,Positive,besttt serummmmm solusi kulit terksturnya enakkkk jerawat cepat kering kulit halus packaging bagus higienis reccomended must haveee worth buy
"Dry, Medium Light, Neutral",Usage Period : 1 week - 1 monthPurchase Point : shopee,maaf cocok kayak kulit sensitif retinol retinol rangkai merk apa wajah bikin kucel kusam idh pakai sunscreen pagi nya cocok cocok pakai coba sayang cocok,3,Neutral,maaf cocok kulit sensitif retinol retinol rangkai merk wajah kucel kusam idh sunscreen pagi nya cocok cocok coba sayang cocok
"Normal, Medium Dark, Neutral",Usage Period : 1 month - 3 monthsPurchase Point : Lazada,beli gara gara sachet kemas botol bikin kulit sehat plumpy pakainyaaa bekas jerawat hitam cepat mudar pori pori lumayan kecil pakai nya repurchase,5,Positive,beli gara gara sachet kemas botol kulit sehat plumpy pakainyaaa bekas jerawat hitam cepat mudar pori pori lumayan nya repurchase
"Dry, Medium, Neutral",Usage Period : More than 1 yearPurchase Point : Shopee,tahun pale retinol somethinc cocok aman banget kulit wajah pakai nya rutin minggu kali tekstur kental serap cepat kulit wajah bangun pagi kulit asa segar cerah bikin pori kecil pengin coba retinol aman ku somethinc retinol jadi opsi,5,Positive,pale retinol somethinc cocok aman kulit wajah nya rutin minggu tekstur kental serap cepat kulit wajah bangun pagi kulit asa segar cerah pori pengin coba retinol aman somethinc retinol opsi
"Combination, Medium, Warm",Usage Period : 6 months - 1 yearPurchase Point : Official Brand Store,serum retinol coba pakai retinol otw  jujur pakai asa ubah signifikan banget bikin kulit plumpy efek muka taapi masuk asa kerut dahi pudar perlahan hilang canggih oiya breakout purging gacocok pakai produk kasih serum besok kulit langsung tenang sih jiwit ngempes,5,Positive,serum retinol coba retinol otw jujur asa ubah signifikan kulit plumpy efek muka taapi masuk asa kerut dahi pudar perlahan hilang canggih oiya breakout purging gacocok kasih serum besok kulit langsung tenang sih jiwit ngempes
"Combination, Medium, Warm",Usage Period : 1 week - 1 monthPurchase Point : Shopee,serum retinol terlembab coba packagingnya botol kaca warna hijau aplikator pump tekstur milky cair ampir aroma pas baurin muka cepat resap kasih efek instant plumping glowing asa pakai serum retinol cekat cekit kering kering kulit muka beginner friendly sekaliii pasti pakai bikin breakout kulit muka asa kenyal bantu kontrol minyak moga promo ya repurchase sih,5,Positive,serum retinol terlembab coba packagingnya botol kaca warna hijau aplikator pump tekstur milky cair ampir aroma pas baurin muka cepat resap kasih efek instant plumping glowing asa serum retinol cekat cekit kering kering kulit muka beginner friendly sekaliii breakout kulit muka asa kenyal bantu kontrol minyak moga promo repurchase sih
"Combination, Medium Light, Warm",Usage Period : 1 month - 3 monthsPurchase Point : Shopee,waswas pakai produk retinol takut cocok breakout coba produk suka banget retinol harsh tekstur creamy minyak pakai teknik sandwich pakai sesuai atur tuh bikin iritasi melembabkan jerawat cepat matang bekas kurang cepat skinbarier oke aman pakai,5,Positive,waswas retinol takut cocok breakout coba suka retinol harsh tekstur creamy minyak teknik sandwich sesuai atur tuh iritasi melembabkan jerawat cepat matang bekas cepat skinbarier oke aman
"Combination, Medium, Neutral",Usage Period : 3 months - 6 monthsPurchase Point : Watson,produk serum retinol nya somethinc oke cocok kulit ku tekstur nya kental warna kuning cepat resap kulit sih bikin lengket pakai malam besok nya kulit wajah plumpy halus cerah worth buy,5,Positive,serum retinol nya somethinc oke cocok kulit tekstur nya kental warna kuning cepat resap kulit sih lengket malam besok nya kulit wajah plumpy halus cerah worth buy
"Normal, Medium Light, Neutral",Usage Period : 3 months - 6 monthsPurchase Point : Shopee,turut retinol cocok mula pertamakali pemakaiaan purging perih kulit suka bikin kulit glowing jarang jerawat cuman pakai,5,Positive,retinol cocok pertamakali pemakaiaan purging perih kulit suka kulit glowing jarang jerawat cuman
"Normal, Medium Dark, Warm",Usage Period : 3 months - 6 monthsPurchase Point : Laris,bikin kulit wajah plumpy halus minim jerawat cerah pakai malam tekstur cair layak serum parfum harap wangi serum resap sabar apply nya imbang rajin pakai sunscreen imbang pakai sunscreen bikin kulit bruntusan kusam lupa pakai moisturizer banget beda kondisi kulit wajah tingkat puji suami,5,Positive,kulit wajah plumpy halus minim jerawat cerah malam tekstur cair layak serum parfum harap wangi serum resap sabar apply nya imbang rajin sunscreen imbang sunscreen kulit bruntusan kusam lupa moisturizer beda kondisi kulit wajah tingkat puji suami
"Combination, Medium Light, Neutral",Usage Period : More than 1 yearPurchase Point : Shopee,retinol turut cocok mula pakai produk repurchase berkalikali pas pakai bikin kering benerbener well hydrated kalo layer serum efek rutin pakai kulit halus plumpy bikin cerah kalo layer serum niacinamide perfect combo,5,Positive,retinol cocok repurchase berkalikali pas kering benerbener well hydrated kalo layer serum efek rutin kulit halus plumpy cerah kalo layer serum niacinamide perfect combo
"Combination, Medium Light, Warm",Usage Period : 1 week - 1 monthPurchase Point : TiktokShop,kali coba pakai retinol ragu ragu minggu pakai effect buruk lumayan rasa kulit pori pori lumayan kecil kulit halus,5,Positive,coba retinol ragu ragu minggu effect buruk lumayan kulit pori pori lumayan kulit halus
"Combination, Medium Light, Neutral",Usage Period : 3 months - 6 monthsPurchase Point : Shopee,kali coba retinolnya somethinc efek negatifbreakout pas bangun tidur kulit lembab banget retinolnya somethinc banget resap kulit butuh hasil hasil signifikan banget cepat hilang jerawat bikin glowing,4,Positive,coba retinolnya somethinc efek negatifbreakout pas bangun tidur kulit lembab retinolnya somethinc resap kulit butuh hasil hasil signifikan cepat hilang jerawat glowing
"Normal, Light, Neutral",Usage Period : 3 months - 6 monthsPurchase Point : Instagram,retinol bulan produk cocok coba retinol retinolnya somethinc timbul cekat cekit wajah muka beruntus cocok serum somethinc malam esok hari muka glowing kencang,5,Positive,retinol cocok coba retinol retinolnya somethinc timbul cekat cekit wajah muka beruntus cocok serum somethinc malam esok muka glowing kencang
"Combination, Light, Cool",Usage Period : 1 month - 3 monthsPurchase Point : Shopee,butuh kandung retinol faktor umur pakai jarang jarang minggu coba retinol merk efek bikin kulit sehat pakai produk retinol kulit breakout jerawat batu muncul tau sih efek retinolnya kandung pakai jerawat kulit terhidasi plumpy jujur bingung reaksi produk kulit,3,Neutral,butuh kandung retinol faktor umur jarang jarang minggu coba retinol merk efek kulit sehat retinol kulit breakout jerawat batu muncul tau sih efek retinolnya kandung jerawat kulit terhidasi plumpy jujur bingung reaksi kulit
"Combination, Light, Neutral",Usage Period : Less than 1 weekPurchase Point : Shopee,kali beli produk retinol pakai serum somethinc bikin jerawat kayak cocok biasa malas pakai serum prefer pakai bakuchiol oilnya somethinc,3,Neutral,beli retinol serum somethinc jerawat cocok malas serum prefer bakuchiol oilnya somethinc
"Combination, Medium, Neutral",Usage Period : 1 month - 3 monthsPurchase Point : Beautyhaulindo,beginner friendly coba pakai retinol kulit sensitif pakai serum tekstur kulit wajah halus botol pumpnya ok solid tekstur watery little thick gampang resap overall good,5,Positive,beginner friendly coba retinol kulit sensitif serum tekstur kulit wajah halus botol pumpnya ok solid tekstur watery little thick gampang resap overall good
"Normal, Medium, Neutral",Usage Period : 1 month - 3 monthsPurchase Point : Shopee,retinol alam milia akh hilang botol pakai menghilanh kecil botol hilang milia mata sulit yuk coba tau kali cocok senang pakai produk hasil muka beli sih,5,Positive,retinol alam milia akh hilang botol menghilanh botol hilang milia mata sulit yuk coba tau cocok senang hasil muka beli sih
"Normal, Medium, Neutral",Usage Period : 6 months - 1 yearPurchase Point : Shopee,satu serum retinol pakai bulan suka nyaman pakai retinol breakout purging hasil mantul banget juara somethinc bikin serum reurchase,5,Positive,serum retinol suka nyaman retinol breakout purging hasil mantul juara somethinc serum reurchase
"Dry, Medium Light, Cool",Usage Period : More than 1 yearPurchase Point : XBeauty by Female Daily,retinol baik mula ringan gentle cocok skin stype guna retinol gunakkan toner moist trlbh lanjut serum ubah mnggu hilang jerawat samar noda hitam bekas flek super highly recommend,5,Positive,retinol ringan gentle cocok skin stype retinol gunakkan toner moist trlbh serum ubah mnggu hilang jerawat samar noda hitam bekas flek super highly recommend
"Oily, Medium, Neutral",Usage Period : 3 months - 6 monthsPurchase Point : Shopee,beli racun teman claimnya serum retinol aman mula tekstur thick ya kental warna putih susu kuning bau khas retinol perfume finishnya lengket bikin wajah glowing pagi hari,5,Positive,beli racun teman claimnya serum retinol aman tekstur thick kental warna putih susu kuning bau khas retinol perfume finishnya lengket wajah glowing pagi
"Oily, Medium Light, Warm",Usage Period : 3 months - 6 monthsPurchase Point : Shopee,lumayan suka kaya produk retinol coba first timer cobacoba takut kalo efek bikin kulit gentle pemulaaa sih recommended,5,Positive,lumayan suka kaya retinol coba first timer cobacoba takut kalo efek kulit gentle pemulaaa sih recommended
"Oily, Medium Light, Neutral",Usage Period : 1 week - 1 monthPurchase Point : Gift,retinol ajaib sih kulit wajah komedokomedo kayak hempas efektif hilang komedo dibandingin aha bha pakai cekitcekit pas pakai malam pakai besok kulit wajah halus bersih cerah wangi enak ya kayak obat papa tolerir,5,Positive,retinol ajaib sih kulit wajah komedokomedo hempas efektif hilang komedo dibandingin aha bha cekitcekit pas malam besok kulit wajah halus bersih cerah wangi enak obat papa tolerir
"Combination, Light, Neutral",Usage Period : 1 month - 3 monthsPurchase Point : Gift,produk hibah teman cocok tekstur oily serap kulit gersang kulit hehe buts okaay greasy sih pakai pas muka lembab versi retinol aman encapsulated seirritan retinol bulan pakai malam bekas jerawat ku pudar tekstur alus secepet retinol lagilagi encapsulated kerja sih repurchase nampol jelek ya,4,Positive,hibah teman cocok tekstur oily serap kulit gersang kulit hehe buts okaay greasy sih pas muka lembab versi retinol aman encapsulated seirritan retinol malam bekas jerawat pudar tekstur alus secepet retinol lagilagi encapsulated kerja sih repurchase nampol jelek
"Oily, Medium, Neutral",Usage Period : 3 months - 6 monthsPurchase Point : Whatsapp,serum retinol super gentle kulit tekstur kayak lotion lembut thick cair aroma sengat mudah diblend tingkat resap lumayan lembap rasa banget apply serum overall suka serum ,5,Positive,serum retinol super gentle kulit tekstur lotion lembut thick cair aroma sengat mudah diblend tingkat resap lumayan lembap apply serum overall suka serum
"Normal, Medium, Neutral",Usage Period : Less than 1 weekPurchase Point : Shopee,kali coba retinol sisa botol sih asa sih next coba retinol merk jujur pakai ngefek kulit sih gapapa coba harga mahal untung pas beli diskon sesak hahaha,4,Positive,coba retinol sisa botol sih asa sih next coba retinol merk jujur ngefek kulit sih gapapa coba harga mahal untung pas beli diskon sesak hahaha
"Dry, Medium, Neutral",Usage Period : More than 1 yearPurchase Point : Shopee,produk retinol bikin purging sih bikin kulit kencang efek lumayan cepat turut kerut kurang banget dahi smile les pakai minggu kali dikit dikit lumayan awet kandung ceramidesnya kalo salah skin loves,5,Positive,retinol purging sih kulit kencang efek lumayan cepat kerut dahi smile les minggu dikit dikit lumayan awet kandung ceramidesnya kalo salah skin loves
"Combination, Light, Cool",Usage Period : 3 months - 6 monthsPurchase Point : tiktok,bagus banget bikin kerut muka pudar muka halus banget plum glow komedo kurang instant yabutuh jerawat nongol langsung mateng beruntus hilang butuh love banget produk tau nemu kurang sesuai kandung kerjain mahal sih,5,Positive,bagus kerut muka pudar muka halus plum glow komedo instant yabutuh jerawat nongol langsung mateng beruntus hilang butuh love tau nemu sesuai kandung kerjain mahal sih
"Combination, Medium Light, Neutral",Usage Period : More than 1 yearPurchase Point : Watson,years ago jerawat kelar skripsi makan iklan coba produk bikin jerawat ku parah coba pakai somethinc lihat beauty influencer hasil bagus ubah wajah banget banget jerawat jerawat bandel pokok somethinc retinol absen menu utama perskin careran  prnya mudarin bekass jerawat ,5,Positive,years ago jerawat kelar skripsi makan iklan coba jerawat parah coba somethinc beauty influencer hasil bagus ubah wajah jerawat jerawat bandel somethinc retinol absen menu utama perskin careran prnya mudarin bekass jerawat
"Combination, Medium, Neutral",Usage Period : 3 months - 6 monthsPurchase Point : Shopee,pakai bagus kurang kerut pasca lahir kemarin tekstur kulit halus bagus pakai malam besok wajah halus lupa pakai sunscreen besok ya aroma enak sih nyengat,5,Positive,bagus kerut pasca lahir kemarin tekstur kulit halus bagus malam besok wajah halus lupa sunscreen besok aroma enak sih nyengat
"Combination, Light, Neutral",Usage Period : 1 week - 1 monthPurchase Point : tiktok,kali coba retinol somethinc review bagus coba layer niacinamide pakai minggu pakai xminggu kulit wajah cocok timbul apa muka cerah sih hehehe garis halus ubah next kalo pakai lama review lagi,5,Positive,coba retinol somethinc review bagus coba layer niacinamide minggu xminggu kulit wajah cocok timbul muka cerah sih hehehe garis halus ubah next kalo review
"Combination, Medium Light, Neutral",Usage Period : 1 month - 3 monthsPurchase Point : Lazada,coba retinol bulan butuh adaptasi awalnyaa bikin muka ku muncul jerawatt works bagus banget lamaa hasil tesktur wajahh ku halus dull skin lumayan dark spot,5,Positive,coba retinol butuh adaptasi awalnyaa muka muncul jerawatt works bagus lamaa hasil tesktur wajahh halus dull skin lumayan dark spot
"Combination, Medium Light, Neutral",Usage Period : 6 months - 1 yearPurchase Point : kkv,truely madly deeply love serum inikareena muka jerawat takut pas coba benar muka bersih kendali jerawat pakein pelembab seram inibahkan toner papa kering muka,4,Positive,truely madly deeply love serum inikareena muka jerawat takut pas coba muka bersih kendali jerawat pakein pelembab seram inibahkan toner papa kering muka
"Normal, Light, Neutral",Usage Period : 6 months - 1 yearPurchase Point : Shopee,coba produk ber retinol coba produk bagus baik tekstur kulit ku kecil pori sama kerut hilang milia  jujur enak banget sesuai claimnya repurchase kali saking neng coba produk retinol overall suka produk rekomendasi teman sih,4,Positive,coba ber retinol coba bagus tekstur kulit pori kerut hilang milia jujur enak sesuai claimnya repurchase saking neng coba retinol overall suka rekomendasi teman sih
"Oily, Medium Light, Neutral",Usage Period : 3 months - 6 monthsPurchase Point : Shopee,aaaaa retinol pertamakuu kali banget coba retinol pilih produk somethinc kali pakai retinol reaksi purging bersih ya keluar kotor wajah purging waspada purging cocok kalo purging mgg habis entar sembuh ganti kulit glowing sehat kulit asa kencang kendor hahah,5,Positive,aaaaa retinol pertamakuu coba retinol pilih somethinc retinol reaksi purging bersih kotor wajah purging waspada purging cocok kalo purging mgg habis entar sembuh ganti kulit glowing sehat kulit asa kencang kendor hahah
"Combination, Medium Light, Neutral",Usage Period : 1 week - 1 monthPurchase Point : Shopee,lumayan coba bebepa serum retinol merk somethinc encapsulated retinol nya salah suka bikin iritasi bikin kering kerontang melembabkan kulit halus jarang jerawat texture serum enak cepat nyerap kulit pokok wajib coba retinol somethinc,5,Positive,lumayan coba bebepa serum retinol merk somethinc encapsulated retinol nya salah suka iritasi kering kerontang melembabkan kulit halus jarang jerawat texture serum enak cepat nyerap kulit wajib coba retinol somethinc
"Combination, Medium, Neutral",Usage Period : 1 month - 3 monthsPurchase Point : Shopee,kalo coba retinol jarang ampuh kamau coba expert banget kandung retinol level plisss ngaruh banget kulit mula ya jujurly banget suka banget produk bagus kalo combi produk kandung niacinamide nya pkok nya best ya,4,Positive,kalo coba retinol jarang ampuh kamau coba expert kandung retinol level plisss ngaruh kulit jujurly suka bagus kalo combi kandung niacinamide nya pkok nya best
"Dry, Medium, Warm",Usage Period : 3 months - 6 monthsPurchase Point : Tokopedia,serum retinol aman banget kulit kering sensitif definisi serum nyaman efek baik kulit isi ml pakai loh sangka pakenya selang seling exfo serum lupa layering hydrating serum nampol efek,5,Positive,serum retinol aman kulit kering sensitif definisi serum nyaman efek kulit isi ml loh sangka pakenya selang seling exfo serum lupa layering hydrating serum nampol efek
"Combination, Light, Warm",Usage Period : 1 week - 1 monthPurchase Point : Tiktok shop,umur takut banget coba serum retinol dengar kalo retinol tuh kandung kuat takut muka cocok  eh beraniin beli coba pakai retinolnya somethinc kali pakai lmyn asa sih efek kulit kulit sekitar hidung tuh suka tekstur pakai asa halus update later ya pakai ,5,Positive,umur takut coba serum retinol dengar kalo retinol tuh kandung kuat takut muka cocok eh beraniin beli coba retinolnya somethinc lmyn asa sih efek kulit kulit hidung tuh suka tekstur asa halus update later
"Combination, Light, Cool",Usage Period : 1 month - 3 monthsPurchase Point : Lazada,retinol pertama pakai cekat cekit pakai minggu kali retinol bahan aktif sensitif hasil jarang banget muncul jerawat mens anti aging timbul efek negatif repurchase sih,5,Positive,retinol cekat cekit minggu retinol bahan aktif sensitif hasil jarang muncul jerawat mens anti aging timbul efek negatif repurchase sih
"Combination, Medium Light, Cool",Usage Period : 1 week - 1 monthPurchase Point : Traditional market,retinol mnurutku melembabkan kulit wajah bangun tidur pagi basuh air wajah bersih alus cocok sih coba retinol harga bawah kalo bagus entar hehe,5,Positive,retinol mnurutku melembabkan kulit wajah bangun tidur pagi basuh air wajah bersih alus cocok sih coba retinol harga kalo bagus entar hehe
",25 - 29",Usage Period : 1 week - 1 monthPurchase Point : Shopee,kulit sensitif benar cocok hiksssss maaf pas pakai panas merah coba kali pakai reaksi wajah cocok sih,2,Negative,kulit sensitif cocok hiksssss maaf pas panas merah coba reaksi wajah cocok sih
"Oily, Medium Light, Warm",Usage Period : 3 months - 6 monthsPurchase Point : Shopee,skeptis nya blend retinol turns really good tekstur semi emulsion cepat nyerap minyak kulit gampang pakai sandwich method aman pakai produk efek samping kering iritasi merah tekstur kulit cerah halus pakai you re looking beginner friendly retinol highly recommend try one,4,Positive,skeptis nya blend retinol turns really good tekstur semi emulsion cepat nyerap minyak kulit gampang sandwich method aman efek samping kering iritasi merah tekstur kulit cerah halus you re looking beginner friendly retinol highly recommend try one
