Skin Type,Usage Periode,Review,Rating,Label,cleaned_review
"Combination, Medium, Warm",Usage Period : More than 1 yearPurchase Point : Shopee,sih hulk somethinc level retinol produk retinol coba pakai retinol bulan retinol untuk usia usia pasuk fase ageing retinol tuju lambat proses penuaaan kulit muda sih kulit awet muda  tahu retinol bahan aktif lumayan takut orang coba malas purging malas ngatasin breakoutnya basic skincare pada mereapply sunscreen kali hari coba retinol ya purging breakout nama emergency skincare panik buat purging breakout retinol somethinc kemas botol kaca warna hijau aplikator pipet serum isi ml turut pakai tetes tekstur cair minyak cepat banget nyerap kulit aroma suka hidung aroma kayak buah belimbing segar pakai retinol step serum kali minggu tekstur cair lengket mudah banget dispread pakenya kering serum kandung ingredients hidrasi glycerin ceramide hyaluronic acid allantoin hasil kagum pakai kulit sehat cerah bulan pakai notice poriporiku samar bersih good job maintenance jerawat aktif retinol andal buat calm radang efek samar noda hitam notice turut bekas jerawat susah samar bekas jerawat samar botol habis,5,Positive,sih hulk somethinc level retinol retinol coba retinol retinol usia usia pasuk fase ageing retinol tuju lambat proses penuaaan kulit muda sih kulit awet muda retinol bahan aktif lumayan takut orang coba malas purging malas ngatasin breakoutnya basic mereapply sunscreen coba retinol purging breakout nama emergency panik purging breakout retinol somethinc kemas botol kaca warna hijau aplikator pipet serum isi ml tetes tekstur cair minyak cepat nyerap kulit aroma suka hidung aroma buah belimbing segar retinol step serum minggu tekstur cair lengket mudah dispread pakenya kering serum kandung ingredients hidrasi glycerin ceramide hyaluronic acid allantoin hasil kagum kulit sehat cerah notice poriporiku samar bersih good job maintenance jerawat aktif retinol andal calm radang efek samar noda hitam notice bekas jerawat susah samar bekas jerawat samar botol habis
"Combination, Medium Light, Neutral",Usage Period : 6 months - 1 yearPurchase Point : Shopee,beli produk orangorang bagus buat kayak ya kayak ubah nyaman pakai lembap lebay bau rutin pakai keliahatan hasil ya,4,Positive,beli orangorang bagus ubah nyaman lembap lebay bau rutin keliahatan hasil
"Dry, Medium Light, Warm",Usage Period : 3 months - 6 monthsPurchase Point : Shopee,kali coba retinol bantu nyamarin kerut jatuh sih somethinc harga oke turut banding serum retinol lain warna nya putih bening ya kuning tekstur super watery habis pakai muka auto alus banget lembab ngefek jujur tau produk somethinc pakai enak banget muka efek kulit aku sedihhh bagus ya love products coba rangkai tapi badak nih kulit coba retinol coba somethinc jangkau turut kaleng,5,Positive,coba retinol bantu nyamarin kerut jatuh sih somethinc harga oke banding serum retinol warna nya putih bening kuning tekstur super watery habis muka auto alus lembab ngefek jujur tau somethinc enak muka efek kulit sedihhh bagus love products coba rangkai badak nih kulit coba retinol coba somethinc jangkau kaleng
"Combination, Dark, Warm",Usage Period : 3 months - 6 monthsPurchase Point : Shopee,kali coba retinol pengin hilang smile les kerut mata pakai malam pagi muka alus bikin bruntus jidat efek anti aging pakai,4,Positive,coba retinol pengin hilang smile les kerut mata malam pagi muka alus bruntus jidat efek anti aging
"Oily, Medium, Warm",Usage Period : 1 month - 3 monthsPurchase Point : Shopee,cerahin kulit bagus banget sih dia cocok kali pakai retinol kali ya biasa pakai kurang kali minggu bikin bruntusan jidat jual nih isi ribu domisili kalimantan thnks tau coba beli full,4,Positive,cerahin kulit bagus sih cocok retinol minggu bruntusan jidat jual nih isi ribu domisili kalimantan thnks tau coba beli full
"Dry, Medium Light, Warm",Usage Period : Less than 1 weekPurchase Point : Shopee,retinol suka sih hasil pakai minggu tambah sih hylarunic nya somethinc kinclong pakai minggu kali rutin tekstur cair bikin susah turut bagus,4,Positive,retinol suka sih hasil minggu sih hylarunic nya somethinc kinclong minggu rutin tekstur cair susah bagus
"Oily, Medium, Neutral",Usage Period : 1 month - 3 monthsPurchase Point : Shopee,tekstur cair banget kayak toner bagus banget ubah kulit notice pakai product jarang jerawat dahi jerawat kecilkecil buah mah cinta banget,5,Positive,tekstur cair toner bagus ubah kulit notice product jarang jerawat dahi jerawat kecilkecil buah mah cinta
"Oily, Medium Light, Neutral",Usage Period : 1 month - 3 monthsPurchase Point : Shopee,retinol aman pakai kulit wajah timbul efek negatif breakout jerawat tekstur cair mudah resap kulit layer serum niacinamide aman pengaruh kulit wajah,5,Positive,retinol aman kulit wajah timbul efek negatif breakout jerawat tekstur cair mudah resap kulit layer serum niacinamide aman pengaruh kulit wajah
"Dry, Light, Cool",Usage Period : 1 month - 3 monthsPurchase Point : Shopee,coba produk retinol kaya jaman pakai erha kandung retinoid retinol kalo somethinc tau efek muka atur pakenya ya produk kali minggu ya cmiiw bikin kulit muka sensitif siang hari malas pakenya coba habisin produk botol kalo efek bagus update reviewnya repurchase  produk somethinc bikin breakout sih muka ku update suka pakai area leher tau double chin baik kulit leher kencang topang lemak leherdagu wkwkwkk,4,Positive,coba retinol kaya jaman erha kandung retinoid retinol kalo somethinc tau efek muka atur pakenya minggu cmiiw kulit muka sensitif siang malas pakenya coba habisin botol kalo efek bagus update reviewnya repurchase somethinc breakout sih muka update suka area leher tau double chin kulit leher kencang topang lemak leherdagu wkwkwkk
"Oily, Medium Dark, Warm",Usage Period : 1 week - 1 monthPurchase Point : Shopee,gue pakai retinol sok first time ever gue langsung jatuh cinta retinolnya sih somethinc fix sih gue repurchase berkalikali haha scroll tiktok konten retinol saran pakai retinol lo masuk umur sok soon hit langsung gue beli jujur gue penasaran brand somethinc hype banget gue cari tau gue bingung jenis serum buanyak banget gue ajar tuh baru gue beli sih retinol gue pakai malam layer niacinamidenya pakai niacinamide deh retinol pagi pas bangun tidur gue langsung muka bagus bekas jerawat mudar muka cerah tekstur muka mulus gradakan guys kayak aspal efek anti agingnya sih tau ya keriput  oh iya pakai retinol lupa pakai moisturizer ya retinol layer aha bha salicylic acid benzoyl peroxide lupa pagi pakai sunscreen ya cantik ,5,Positive,gue retinol sok first time ever gue langsung jatuh cinta retinolnya sih somethinc fix sih gue repurchase berkalikali haha scroll tiktok konten retinol saran retinol lo masuk umur sok soon hit langsung gue beli jujur gue penasaran brand somethinc hype gue cari tau gue bingung jenis serum buanyak gue ajar tuh gue beli sih retinol gue malam layer niacinamidenya niacinamide retinol pagi pas bangun tidur gue langsung muka bagus bekas jerawat mudar muka cerah tekstur muka mulus gradakan guys aspal efek anti agingnya sih tau keriput oh iya retinol lupa moisturizer retinol layer aha bha salicylic acid benzoyl peroxide lupa pagi sunscreen cantik
"Combination, Medium Light, Cool",Usage Period : Less than 1 weekPurchase Point : Official Brand Store,enak bikin cekit efek apa kulit enak banget layer pakai malam efek kelupas bikin kulit smooth jarang jarang pakai nya layer skin care ok mula coba retino bikin mulus kulit,4,Positive,enak cekit efek kulit enak layer malam efek kelupas kulit smooth jarang jarang nya layer skin care ok coba retino mulus kulit
"Combination, Light, Neutral",Usage Period : 3 months - 6 monthsPurchase Point : Beautyhaulindo,ure suffering pihpie plis coba breakout parah bekas campur pih pie anddd serum works amazingly bothwaysss maju mundur ingredients retinol gacocok usia dermatologists n experts saran avoid retinol hit luckily dermatologists says okay pas pakai langsung jatuh cinta banget ajaaib semalem langsung smoothing bekas jerawat tekstur baik banget pake banget kaget haru ku ikhlas kalo kulit mulus kayak asih cercah harap cercah bong kulit gue bekas jerawat pakai ngelak kalo bantu treatment dokter plis gue pastiin banget kalo plays major part skin improvements tekstur cair banget suka dripping kalo ditetesin muka cepat nyerepnya pakai build jeda minggu minggu minggu kali maintain minggu kali pakai kulit gue oke sayang skin never better im using undeniable too beli deh,5,Positive,ure suffering pihpie plis coba breakout parah bekas campur pih pie anddd serum works amazingly bothwaysss maju mundur ingredients retinol gacocok usia dermatologists n experts saran avoid retinol hit luckily dermatologists says okay pas langsung jatuh cinta ajaaib semalem langsung smoothing bekas jerawat tekstur pake kaget haru ikhlas kalo kulit mulus asih cercah harap cercah bong kulit gue bekas jerawat ngelak kalo bantu treatment dokter plis gue pastiin kalo plays major part skin improvements tekstur cair suka dripping kalo ditetesin muka cepat nyerepnya build jeda minggu minggu minggu maintain minggu kulit gue oke sayang skin never better im using undeniable too beli
"Combination, Medium, Warm",Usage Period : 1 month - 3 monthsPurchase Point : Tokopedia,orang kali pakai serum retinol cocok berani coba suka banget banget parah pakai efek negatif apa kulit wajah kering kadang bruntusan banget hydratingnya kudu dikencengin layak pakai zat aktif hasil kulit cerah banding pakai peeling aha bha garis halus hilang pudar warna kulit rata jerawat haid komedo pakai peeling apa harga jangkau hasil bagus suami notice banget sayang banget produk gampaaang banget oksidasi minggu kuning hasil bagus kemas tekstur semi lotion warna putih botol solid transparan paonya ubah simpan kulkas ribet sih ya,5,Positive,orang serum retinol cocok berani coba suka parah efek negatif kulit wajah kering kadang bruntusan hydratingnya kudu dikencengin layak zat aktif hasil kulit cerah banding peeling aha bha garis halus hilang pudar warna kulit jerawat haid komedo peeling harga jangkau hasil bagus suami notice sayang gampaaang oksidasi minggu kuning hasil bagus kemas tekstur semi lotion warna putih botol solid transparan paonya ubah simpan kulkas ribet sih
"Combination, Medium, Warm",Usage Period : 3 months - 6 monthsPurchase Point : Tokopedia,tau habis pakai muka terbit jerawat pms pakai minggu sekali pakai jerawat habis pakai bikin muka halus efek jerawat bikin malas sisa pakai leher biar aman,2,Negative,tau habis muka terbit jerawat pms minggu jerawat habis muka halus efek jerawat malas sisa leher biar aman
"Normal, Medium Light, Neutral",Usage Period : 1 week - 1 monthPurchase Point : Shopee,cerita umur concern bekas jerawat merah coklat jerawat hormonal maju mundur pakai bagus banget kulit bekas jerawat pudar jerawat hormonalnya kurang retinol somethinc masuk kategori encapsulate retinol gentle aman pakai cekit pakenya aman bikin kulit kering pakai hydrating tonerretinol somethincniacinamide somethinc pakai juara,5,Positive,cerita umur concern bekas jerawat merah coklat jerawat hormonal maju mundur bagus kulit bekas jerawat pudar jerawat hormonalnya retinol somethinc masuk kategori encapsulate retinol gentle aman cekit pakenya aman kulit kering hydrating tonerretinol somethincniacinamide somethinc juara
"Combination, Medium, Neutral",Usage Period : 1 month - 3 monthsPurchase Point : Lazada,iseng pakai beli paket hyalu niacin moisture beet produk punya buka warna kuning pakai minggu minggu biasa retinol bahan pakai retinol enkapsulasi buat retinol somethinc keras berlayerlayer pelembab pakai efek timbul ngeri banget ok jerawat cepat kering poripori kecil proses regenerasi kulit cepat habis basuh muka pakai air langsung kulit akan kikis muka putihputih duga asal kulit mati ganti stimulasi sih retinol kayak aku serba salah cuci muka takut ambil wudhu takut moisturizer kandung ceramide muka sensitif banget cahaya matahari kulit gampang timbul alergi untung nemu trik pakai amanaman pakai minggu pakai cinta banget retinol sayang timbul segi produk oksidasi punya warna cokelat banget pakai sih jelas somethinc ubah warna aman,5,Positive,iseng beli paket hyalu niacin moisture beet buka warna kuning minggu minggu retinol bahan retinol enkapsulasi retinol somethinc keras berlayerlayer pelembab efek timbul ngeri ok jerawat cepat kering poripori proses regenerasi kulit cepat habis basuh muka air langsung kulit kikis muka putihputih duga kulit mati ganti stimulasi sih retinol serba salah cuci muka takut ambil wudhu takut moisturizer kandung ceramide muka sensitif cahaya matahari kulit gampang timbul alergi untung nemu trik amanaman minggu cinta retinol sayang timbul segi oksidasi warna cokelat sih somethinc ubah warna aman
"Oily, Medium, Neutral",Usage Period : 1 month - 3 monthsPurchase Point : Shopee,bagus bikin muka jarang jerawat jrwt bo prodk bantu nyembuhin banget pakai produk kandung tretinoinvitacid bikin mulus bikin muka ngelupas jelek banget yaudah cari alternatif ganti ketemu retinol somethinc bikin muka perih ngelupasnya ganggu samsek benar suka updated retinol somethinc baru ganti tekstur kaya kayak bening air kentel putih serap bagus bikin purging ngelupas parah,5,Positive,bagus muka jarang jerawat jrwt bo prodk bantu nyembuhin kandung tretinoinvitacid mulus muka ngelupas jelek yaudah cari alternatif ganti ketemu retinol somethinc muka perih ngelupasnya ganggu samsek suka updated retinol somethinc ganti tekstur kaya bening air kentel putih serap bagus purging ngelupas parah
"Combination, Medium, Neutral",Usage Period : 3 months - 6 monthsPurchase Point : Shopee,retinol coba kondisi muka bo cocok niacinamide minggu pakai jeda ngempesin jerawat bo alhamdulillah pakai rasai purging aga nampol kalo pakai serum single layer serum kalo layer pakai alpha arbutinnya avoskin maut bantu nyamarin bekas jerawat pie ,5,Positive,retinol coba kondisi muka bo cocok niacinamide minggu jeda ngempesin jerawat bo alhamdulillah rasai purging aga nampol kalo serum single layer serum kalo layer alpha arbutinnya avoskin maut bantu nyamarin bekas jerawat pie
"Normal, Light, Neutral",Usage Period : 1 month - 3 monthsPurchase Point : Shopee,bagus banget sumpah wajah tuh halussss banget parah jerawat cepat kering komedo hilang gabung bakuchiolnya somethinc pokok suka banget banget nyetok sih product andal banget,5,Positive,bagus sumpah wajah tuh halussss parah jerawat cepat kering komedo hilang gabung bakuchiolnya somethinc suka nyetok sih product andal
"Oily, Light, Neutral",Usage Period : 1 month - 3 monthsPurchase Point : Shopee,pakai fss retinol suka banget efek retinol somethinc produk kecewa putus coba produk testurnya ringan banget mudah aplikasi efek produk mudah banget oksidasi produk mild banget kali coba retinol produk banget coba,4,Positive,fss retinol suka efek retinol somethinc kecewa putus coba testurnya ringan mudah aplikasi efek mudah oksidasi mild coba retinol coba
"Combination, Medium Light, Warm",Usage Period : 1 month - 3 monthsPurchase Point : Shopee,orangorang cocok produk stop pakai wkwk efek negatif apa pakai tapiiii warna produk kuning gumpal kuning hubungin cs ganti tapiiiiiii ujungujungnya mengungin gumpal simpan kulkas sinar matahari huhu sedih sih pakai retinol oh iya pakenya kemas kotak ya bulat kayak,3,Neutral,orangorang cocok stop wkwk efek negatif tapiiii warna kuning gumpal kuning hubungin cs ganti tapiiiiiii ujungujungnya mengungin gumpal simpan kulkas sinar matahari huhu sedih sih retinol oh iya pakenya kemas kotak bulat
"Combination, Medium Dark, Warm",Usage Period : 1 month - 3 monthsPurchase Point : Shopee,coba retinol nya somethinc kali coba retinol mild banget nimbulin efek aneh sok good sign tekstur cair cepat banget menyerapny drying habis pakai langsung timpa pakai facial oil pakenya layer serum kulit badak ngaruh samsek pih jerawattapi ngaruh banget pori kaget bangun kayak pori repurchase sih,4,Positive,coba retinol nya somethinc coba retinol mild nimbulin efek aneh sok good sign tekstur cair cepat menyerapny drying habis langsung timpa facial oil pakenya layer serum kulit badak ngaruh samsek pih jerawattapi ngaruh pori kaget bangun pori repurchase sih
"Combination, Medium, Neutral",Usage Period : 3 months - 6 monthsPurchase Point : Shopee,rekomended banget sesal pakai somethinc retinol cocok banget muka cuman lengket nyerepnya cepat banget bikin muka bekas jerawat mudar gabung niacinimade cocok,5,Positive,rekomended sesal somethinc retinol cocok muka cuman lengket nyerepnya cepat muka bekas jerawat mudar gabung niacinimade cocok
"Combination, Light, Cool",Usage Period : More than 1 yearPurchase Point : Instagram,btw gue pakai leher  biar nyamarin kerut leher auto kerut leher kurang parah banget tekstur cair kayak warna kuning coklat packaging suka kaca trz pendek nyaman bawa kmn gede banget  lp leher tambah moisture  biar kering,5,Positive,btw gue leher biar nyamarin kerut leher auto kerut leher parah tekstur cair warna kuning coklat packaging suka kaca trz pendek nyaman bawa kmn gede lp leher moisture biar kering
"Combination, Medium Light, Neutral",Usage Period : 3 months - 6 monthsPurchase Point : Shopee,kaya lovehate relationship somethinc cocok cocok banget produk retinolnya salah cocok pakai pakai hasil banget tekstur kulit wajah kasar tau kayak komedo putih mendem tuh maksud agam pricey turut ya repurchase lol,4,Positive,kaya lovehate relationship somethinc cocok cocok retinolnya salah cocok hasil tekstur kulit wajah kasar tau komedo putih mendem tuh maksud agam pricey repurchase lol
"Oily, Medium, Warm",Usage Period : 3 months - 6 monthsPurchase Point : Shopee,first retinol quite gentle mild progres slow sure mildgentle banget progres skin texture pih pie ok banget prevent hormonal acne kalo layering bareng niacinamidenya skingame theory everything tekturnya juara retinol serum tering coba watery absorbs perfectly bau chemical still okay id highly recommend wants try retinol first time good start beginner,5,Positive,first retinol quite gentle mild progres slow sure mildgentle progres skin texture pih pie ok prevent hormonal acne kalo layering bareng niacinamidenya skingame theory everything tekturnya juara retinol serum tering coba watery absorbs perfectly bau chemical still okay id highly recommend wants try retinol first time good start beginner
"Dry, Medium, Neutral",Usage Period : Less than 1 weekPurchase Point : Shopee,tekstur cair gerah cepat nyerep ku pakai retinol nya habis lihat review bagus beauty vlogger teman sok far kulit ku jerawat mateng masker kempes pakai semalem aga amazing sih we ll sih botol habis rekomen course,5,Positive,tekstur cair gerah cepat nyerep retinol nya habis review bagus beauty vlogger teman sok far kulit jerawat mateng masker kempes semalem aga amazing sih we ll sih botol habis rekomen course
"Oily, Medium, Neutral",Usage Period : 1 month - 3 monthsPurchase Point : Shopee,pakai habis botol ubah sih jerawat baik banget cerah sih bareng pakai niacinamide ngefek banget jerawat baik cocok sih pakai coba serum retinol,4,Positive,habis botol ubah sih jerawat cerah sih bareng niacinamide ngefek jerawat cocok sih coba serum retinol
"Oily, Medium, Warm",Usage Period : 3 months - 6 monthsPurchase Point : JD.id,tekstur air toner nyerapnya cepat sih efeknyaa nampol banget besok muka haluss tekstur baik jerawat gampang kempes bruntusan hilang minyak kontrol sangka banget  somethinc reformulate ya suka ,5,Positive,tekstur air toner nyerapnya cepat sih efeknyaa nampol besok muka haluss tekstur jerawat gampang kempes bruntusan hilang minyak kontrol sangka somethinc reformulate suka
"Combination, Medium Light, Cool",Usage Period : 3 months - 6 monthsPurchase Point : Shopee,retinol aman kulit sensitif harga jangkau nyaman pakai kali minggu kali minggu pengin pakai banget habis pakai malam pagi kulit bagus,5,Positive,retinol aman kulit sensitif harga jangkau nyaman minggu minggu pengin habis malam pagi kulit bagus
"Combination, Medium Light, Neutral",Usage Period : 1 month - 3 monthsPurchase Point : Shopee,retinol pake turut cocok mula pakai kulit minggu munculin jerawat yes kulit kering banget tambah serum hyaluronic acidnya bulan stop pakai serum ini texture serum lumayan ubah warna serum cepat oksidasi,3,Neutral,retinol pake cocok kulit minggu munculin jerawat yes kulit kering serum hyaluronic acidnya stop serum texture serum lumayan ubah warna serum cepat oksidasi
"Normal, Medium, Warm",Usage Period : 1 week - 1 monthPurchase Point : Shopee,banget kulit sehatapalagi henti cream etiket biru jual bebas klinjk cantik kulit wajah bruntusan berteksture minggu pakai kali hasil ingat busui henti,5,Positive,kulit sehatapalagi henti cream etiket biru jual bebas klinjk cantik kulit wajah bruntusan berteksture minggu hasil busui henti
"Combination, Medium, Neutral",Usage Period : 1 month - 3 monthsPurchase Point : Official Brand Store,update jatuh cinta retinolnya somethinc bantu banget sembuh breakout kunyobain versi baru sih level encapsulated retinol bulan pakai minggu kali sok far sok good galau granactive snow encapsulated pure retinol jujur takut pas awalawal coba kulit suka sensy produk reformula alhamdulillah cocokcocok pakai purging dikit dahi pipi jerawat kecilkecil lekas kering hilang rasa banget beda ya habis retinolan pagi kulit plumpy glowing bersih poriporinya suka tekstur tekstur tekstur emulsion ringancair nyaman muka bau sih banding bekas jerawat pudar bekas jerawat love retinol sok much,5,Positive,update jatuh cinta retinolnya somethinc bantu sembuh breakout kunyobain versi sih level encapsulated retinol minggu sok far sok good galau granactive snow encapsulated pure retinol jujur takut pas awalawal coba kulit suka sensy reformula alhamdulillah cocokcocok purging dikit dahi pipi jerawat kecilkecil lekas kering hilang beda habis retinolan pagi kulit plumpy glowing bersih poriporinya suka tekstur tekstur tekstur emulsion ringancair nyaman muka bau sih banding bekas jerawat pudar bekas jerawat love retinol sok much
"Normal, Medium Light, Neutral",Usage Period : More than 1 yearPurchase Point : Beautyhaulindo,first retinol beli pas kali somethinc launch ku pakai masuk usia usaha maintain kit tanda tua kulit tekstur encer fast absorb pakai malam hindar layering vitamin sih takut reaktif hasil,5,Positive,first retinol beli pas somethinc launch masuk usia usaha maintain kit tanda tua kulit tekstur encer fast absorb malam hindar layering vitamin sih takut reaktif hasil
"Combination, Medium, Neutral",Usage Period : 6 months - 1 yearPurchase Point : Gift,bagus banget sih pokok texturenya tuh cair kocok pakai cepettt banget nyerap kulit kayak hyaluronic bnya kalo malam pakai besok pagi muka rasa alusss banget problem bau kayak tape hahaha buat ganggu sih kuat tekstur bau niacinamidenya,5,Positive,bagus sih texturenya tuh cair kocok cepettt nyerap kulit hyaluronic bnya kalo malam besok pagi muka alusss problem bau tape hahaha ganggu sih kuat tekstur bau niacinamidenya
"Combination, Medium Light, Neutral",Usage Period : 1 month - 3 monthsPurchase Point : Beauty Studio,maju mundur coba retinol beli paket holiday kayak paham pakai retinol lho haha pas coba pakai muka kering bagus haha trauma pakai,2,Negative,maju mundur coba retinol beli paket holiday paham retinol lho haha pas coba muka kering bagus haha trauma
",25 - 29",Usage Period : 6 months - 1 yearPurchase Point : Shopee,gunain retinol somethinc bulan habis botol coba retinol bentuk cream rani coba produk aman kulit sensitif gunain minggu kali hasil tekstur kulit baik tau jerawat hilang timbul wajah sensitif produk bagus digunain kali minggu,3,Neutral,gunain retinol somethinc habis botol coba retinol bentuk cream rani coba aman kulit sensitif gunain minggu hasil tekstur kulit tau jerawat hilang timbul wajah sensitif bagus digunain minggu
"Dry, Medium Light, Warm",Usage Period : 3 months - 6 monthsPurchase Point : Shopee,retinol pertama pakai minggu khawatir kulit ku nagih retinol  sok far keluh guna minggu aging jaga atur keriput fine line tahan muncul ,5,Positive,retinol minggu khawatir kulit nagih retinol sok far keluh minggu aging jaga atur keriput fine line tahan muncul
"Combination, Medium Light, Neutral",Usage Period : 3 months - 6 monthsPurchase Point : Beauty Studio,salah product ampuh banget buah pih ku susah banget ilangnya pas nyobaiin minggu kaget banget langsung hilang pih ku upload twitter ku naaazzzs pakai nya kali minggu,5,Positive,salah product ampuh buah pih susah ilangnya pas nyobaiin minggu kaget langsung hilang pih upload twitter naaazzzs nya minggu
"Combination, Light, Cool",Usage Period : Less than 1 weekPurchase Point : Shopee,varian pakai retinol coba pakai somethinc retinol easy use mudah ubah warna klaim fungsi ubah warna pakai purging bulan baik muncul pakai malam pagi merah kurang jerawat calm tahap purging edit review edit var stabil warna putih thick enak pakai bikin iritasi efek lumayan ngaruh bagun tidur muka cerah jerawat hormonal parah muncul suka var,4,Positive,varian retinol coba somethinc retinol easy use mudah ubah warna klaim fungsi ubah warna purging muncul malam pagi merah jerawat calm tahap purging edit review edit var stabil warna putih thick enak iritasi efek lumayan ngaruh bagun tidur muka cerah jerawat hormonal parah muncul suka var
