Skin Type,Usage Periode,Review,Rating,Label,cleaned_review
"Dry, Medium Light, Cool",Usage Period : Less than 1 weekPurchase Point : Shopee,soldnyarinya susah ampun sekali cocok kulit acne prone dry skin nimbulin jerawat bagus baik tekstur kulit scarnya kecil pori pori bikin perih panas ngelupas glowing telah kasih serum hyalu tonernya pakai hydrating jual isi makenya taruh tangan pipet higienis beli tanggal kemarin lokasi jombang,5,Positive,soldnyarinya susah ampun cocok kulit acne prone dry skin nimbulin jerawat bagus tekstur kulit scarnya pori pori perih panas ngelupas glowing kasih serum hyalu tonernya hydrating jual isi makenya taruh tangan pipet higienis beli tanggal kemarin lokasi jombang
"Combination, Light, Cool",Usage Period : Less than 1 weekPurchase Point : Shopee,yayyyyy retinol dua avoskin kurleb minggu kupake bit stronger lebib potent dikit banding avoskin turns aman banget pakai minggu efek kering gaenak lembap enak bingung pakai sih tetes jari langsung baurin muka runny encer banget jdnya kuratain tangan bentar langsung baur muka bau aneh siii minggu pakai efek pori enakbgt oaling rasa bekas jerawat lebib kalem sih kilas pudar well sih depan ya,5,Positive,yayyyyy retinol avoskin kurleb minggu kupake bit stronger lebib potent dikit banding avoskin turns aman minggu efek kering gaenak lembap enak bingung sih tetes jari langsung baurin muka runny encer jdnya kuratain tangan bentar langsung baur muka bau aneh siii minggu efek pori enakbgt oaling bekas jerawat lebib kalem sih kilas pudar well sih
"Combination, Medium Light, Neutral",Usage Period : 1 month - 3 monthsPurchase Point : Beautyhaulindo,coba retinol sebelumnyatelat banget emgpackaging ukur pas ml botol hijau gelapcukup bagus mengungat vita stabil cahaya udara tekstur kuning coklat cepat serap lengket aplikasikanformula kandung ceramideyg bantu jaga kembali skin barrier koreksi kalo salah vit nya enkapsulasi vita nya stabil realita warna kuning coklat cepat ubah coklathuhu efek muka benar ilangin flek hitam ku wajahsignifikan lho mnurutku cekit pakai area dahi kering umur oia buatacne spot kurang banget lumayan ukur lokal lahrepurchase nomau coba brand ,5,Positive,coba retinol sebelumnyatelat emgpackaging ukur pas ml botol hijau gelapcukup bagus mengungat vita stabil cahaya udara tekstur kuning coklat cepat serap lengket aplikasikanformula kandung ceramideyg bantu jaga skin barrier koreksi kalo salah vit nya enkapsulasi vita nya stabil realita warna kuning coklat cepat ubah coklathuhu efek muka ilangin flek hitam wajahsignifikan lho mnurutku cekit area dahi kering umur oia buatacne spot lumayan ukur lokal lahrepurchase nomau coba brand
"Dry, Light, Neutral",Usage Period : 3 months - 6 monthsPurchase Point : Shopee,akhirnyaa back welcome back retinol retinol kunci sih cocok banget produkproduk skincare kandung retinol kulit alami sembuh pakai retinol manfaat retinol cantik kulit antiaging sembuh jerawat kecil poripori henti retinol hamil susu awal guna retinol rekomendasi sih somethinc level kandung retinolnya rendah banding product tuh mix hyaluronic acid fungsi melembabkan guna bikin kulit wajah hidrasi kering telah pakai malam guna niacinamide night cream efek guna bulan warna kulit wajah rata hilang noda bekas jerawat kecil poripori cerah cepatbangun pagi kulit wajah langsung asa bahagia hahahah duh ya bahasa jujur semenjak pakai retinol yes skin love,4,Positive,akhirnyaa back welcome back retinol retinol kunci sih cocok produkproduk kandung retinol kulit alami sembuh retinol manfaat retinol cantik kulit antiaging sembuh jerawat poripori henti retinol hamil susu retinol rekomendasi sih somethinc level kandung retinolnya rendah banding product tuh mix hyaluronic acid fungsi melembabkan kulit wajah hidrasi kering malam niacinamide night cream efek warna kulit wajah hilang noda bekas jerawat poripori cerah cepatbangun pagi kulit wajah langsung asa bahagia hahahah duh bahasa jujur semenjak retinol yes skin love
"Normal, Medium Light, Neutral",Usage Period : 3 months - 6 monthsPurchase Point : Beauty Studio,pas pengin beli pas langkabahkan officialnya kosong alhamdulillah beuty studio syukaaa banget jenis retinol kayak ginimild keringga biikin ngelupas dah krg nyaman kulit kulit asik pakai inidan efek cocok meong,5,Positive,pas pengin beli pas langkabahkan officialnya kosong alhamdulillah beuty studio syukaaa jenis retinol ginimild keringga biikin ngelupas dah krg nyaman kulit kulit asik inidan efek cocok meong
"Combination, Light, Warm",Usage Period : 3 months - 6 monthsPurchase Point : Beautyhaulindo,pakai botol abisga berefekapa retinolnya brand pakai retinol bikin bruntusan kulit merah sih bikin kulit terkelupashanya pakai malam haribotolnya,4,Positive,botol abisga berefekapa retinolnya brand retinol bruntusan kulit merah sih kulit terkelupashanya malam haribotolnya
"Oily, Medium, Neutral",Usage Period : 1 month - 3 monthsPurchase Point : Shopee,first thing first skin type sensitive acne prone oily dull muka gue break parah gara-gara pakai benton essence yaudahlah stop pakai pakai retinol ordinary muka gue langsung merah banget kayak lobster september berani pakai retinol pilih avoskin harga affordable somethinc ku pakai daaaaaaaaan pakai suka puas kulit jerawat breakout akibat benton mulus tekstur kulit ku gampang jerawat tinggal bekas nya iniiii bekas jerawat pudar pakai jeda kali minggu pakai retinol day always apply sunscreen pakai malam pakai campur aloevera shooting gel nya innisfree parah bikin iritasi kulit love moga kulit ku mulus hilang bekas jerawatdark spots nya,5,Positive,first thing first skin type sensitive acne prone oily dull muka gue break parah gara-gara benton essence yaudahlah stop retinol ordinary muka gue langsung merah lobster september berani retinol pilih avoskin harga affordable somethinc daaaaaaaaan suka puas kulit jerawat breakout akibat benton mulus tekstur kulit gampang jerawat tinggal bekas nya iniiii bekas jerawat pudar jeda minggu retinol day always apply sunscreen malam campur aloevera shooting gel nya innisfree parah iritasi kulit love moga kulit mulus hilang bekas jerawatdark spots nya
"Normal, Medium Light, Neutral",Usage Period : 3 months - 6 monthsPurchase Point : Brand website,cari retinolku coba retinol lumayan rendah kadar gue berani coba kadar turns wow pakai langsung harga murah riah banget cinta mati,5,Positive,cari retinolku coba retinol lumayan rendah kadar gue berani coba kadar turns wow langsung harga murah riah cinta mati
"Oily, Medium Dark, Warm",Usage Period : 1 month - 3 monthsPurchase Point : Shopee,kali coba retinol aman muka gue lumayan sensitif gue makenya kali minggu gue pakai refining serum nya avoskin kali minggu beda gue kalo somethinc efek ngempesin jerawat gue tumbuh gajadi nongol gue pakai avoskin kalo jerawat kalo muka cerah dark spot cepat hilang sih gue ya somethinc avoskin efek pakai produk mantul deh muka gue,5,Positive,coba retinol aman muka gue lumayan sensitif gue makenya minggu gue refining serum nya avoskin minggu beda gue kalo somethinc efek ngempesin jerawat gue tumbuh gajadi nongol gue avoskin kalo jerawat kalo muka cerah dark spot cepat hilang sih gue somethinc avoskin efek mantul muka gue
"Dry, Medium Light, Warm",Usage Period : 1 month - 3 monthsPurchase Point : Brand website,semenjak produk launched tuh nyarinya kali bulan pakai serum retinol cari mild encapsulated retinol tampak coba minim efek iritasi stabil ingredient unggul hyaluronic acid allantoin ceramide dll bulan pakai tekstur kulit plump cerah bantu samar acne scars pori pori bikin kulit halus gong sukses ngeangkat kulit sekitar smile les kering bulan kemarin kulit dehydrated wuah kayak pakai serum high end loh resultnya percaya harga affordable minggu pakai sih deg degan timbul jerawat gede serum pms pakai syukur ngelewatin purging bo bikin kulit kering iritasi pakai pm routine one drop wangi strong tekstur cair,5,Positive,semenjak launched tuh nyarinya serum retinol cari mild encapsulated retinol coba minim efek iritasi stabil ingredient unggul hyaluronic acid allantoin ceramide dll tekstur kulit plump cerah bantu samar acne scars pori pori kulit halus gong sukses ngeangkat kulit smile les kering kemarin kulit dehydrated wuah serum high end loh resultnya percaya harga affordable minggu sih deg degan timbul jerawat gede serum pms syukur ngelewatin purging bo kulit kering iritasi pm routine one drop wangi strong tekstur cair
"Normal, Medium Light, Neutral",Usage Period : Less than 1 weekPurchase Point : Beauty Studio,bagus banget mah serum bawjib wajib nangett ciwi ciwi ampu banget hilang bekas jerawat ban melembabkan kulit wajah auto glowing deh pakai sih ampuh pol banget,5,Positive,bagus mah serum bawjib wajib nangett ciwi ciwi ampu hilang bekas jerawat ban melembabkan kulit wajah auto glowing sih ampuh pol
"Combination, Light, Cool",Usage Period : 1 month - 3 monthsPurchase Point : Shopee,dabest badabum layerin niacinamide nya bombastis bekas jerawat hilang somethinc sulit cari lop yuk repurchase recommended abisssss mantap yahut makblar,5,Positive,dabest badabum layerin niacinamide nya bombastis bekas jerawat hilang somethinc sulit cari lop yuk repurchase recommended abisssss mantap yahut makblar
"Oily, Medium Dark, Warm",Usage Period : 1 week - 1 monthPurchase Point : Shopee,kali banget pakai retinol takut sih hehe pakai retinol dibarengin serum niacinnya somethinc telah pakein moist cos rx oil free hasil sih lumayan bagus jerawat besok kempes kulit wajah bagus pakai minggu kali minggu blunder banget pakai besok kulit hidung ku kelupas sakit ya kayak kelupas tipis ya salah ku sih serum bagus pakenya,4,Positive,retinol takut sih hehe retinol dibarengin serum niacinnya somethinc pakein moist cos rx oil free hasil sih lumayan bagus jerawat besok kempes kulit wajah bagus minggu minggu blunder besok kulit hidung kelupas sakit kelupas tipis salah sih serum bagus pakenya
"Combination, Medium, Neutral",Usage Period : 1 week - 1 monthPurchase Point : Shopee,gunain efek kulit kenyal gampang jerawat ampuh rata tekstur kulit samar poripori rasai efek retinolnya samar garis halus area mata pakai bulan depan efek cegah kurang tua kulit repurchase produk,4,Positive,gunain efek kulit kenyal gampang jerawat ampuh tekstur kulit samar poripori rasai efek retinolnya samar garis halus area mata efek cegah tua kulit repurchase
"Combination, Medium Light, Cool",Usage Period : 1 month - 3 monthsPurchase Point : Shopee,bagus banget benerin tekstur kulit pas awalawal pakai purging minggu area dahi dagu jerawat hilang tekstur kulit baik pakai malemnya pagi muka halus kayak repurchase habis,4,Positive,bagus benerin tekstur kulit pas awalawal purging minggu area dahi dagu jerawat hilang tekstur kulit malemnya pagi muka halus repurchase habis
"Combination, Medium Light, Neutral",Usage Period : 1 month - 3 monthsPurchase Point : Shopee,bagus banget jerawat kontrol banget sakitt banget semenjak pakai jerawat kontrol banget jerawat gede hilang jarang jerawat serius cinta banget product susah banget beli sold nya cepat banget ,5,Positive,bagus jerawat kontrol sakitt semenjak jerawat kontrol jerawat gede hilang jarang jerawat serius cinta product susah beli sold nya cepat
"Oily, Medium Light, Warm",Usage Period : 3 months - 6 monthsPurchase Point : Shopee,serum bagus banget benerbener bikin wajah enak halus bersih lembut bikin jerawat benerbener gentle retinol nya mula tuh benerbener best banget,5,Positive,serum bagus benerbener wajah enak halus bersih lembut jerawat benerbener gentle retinol nya tuh benerbener best
"Combination, Medium, Neutral",Usage Period : 3 months - 6 monthsPurchase Point : Shopee,serum somethinc pakai mnrtku serum pulang sakti sengaja pakai pas muka bruntusan kecil mlmnya pakai surprisingly pagi bruntusan hilang pakai minggu kali minggu pakai untung efek kemerahanperih dll sih muka bagus hari cinta banget pokok sih retinol sayang susah banget nyarinya suka kewalahan kalo restock,5,Positive,serum somethinc mnrtku serum pulang sakti sengaja pas muka bruntusan mlmnya surprisingly pagi bruntusan hilang minggu minggu untung efek kemerahanperih dll sih muka bagus cinta sih retinol sayang susah nyarinya suka kewalahan kalo restock
"Normal, Medium Light, Warm",Usage Period : 1 month - 3 monthsPurchase Point : Shopee,pakai kulit merah tanda jerawat muncul bruntusan isi komedo iya jerawat komedo muka kulitefek retinol ubah heboh minggu pakai minggu pakai tone kulit bikin bekas jerawat  minggu pakai tekstur kulit rata gradakan purgingku selesai minggu muncul jerawat lifestyle sehat begadang  alhamdulillah membaikdengan retinol bekas jerawat cepat pudar kerut dll tau,5,Positive,kulit merah tanda jerawat muncul bruntusan isi komedo iya jerawat komedo muka kulitefek retinol ubah heboh minggu minggu tone kulit bekas jerawat minggu tekstur kulit gradakan purgingku selesai minggu muncul jerawat lifestyle sehat begadang alhamdulillah membaikdengan retinol bekas jerawat cepat pudar kerut dll tau
"Dry, Light, Neutral",Usage Period : 3 months - 6 monthsPurchase Point : Beautyhaulindo,first time pakai retinol pakai bahan aktf golong gentle banget kulit sensitive awlnya baca pakai tahap kulit langsung pakai hari pakai wajib banget pakai pelembab extra dry kulit dry semenjak pakai jujur komedo hidung banget kurang sih hijau cabe rawit cocok banget pakai niacinamide hyalu love banget,5,Positive,first time retinol bahan aktf golong gentle kulit sensitive awlnya baca tahap kulit langsung wajib pelembab extra dry kulit dry semenjak jujur komedo hidung sih hijau cabe rawit cocok niacinamide hyalu love
"Oily, Medium Light, Neutral",Usage Period : 1 month - 3 monthsPurchase Point : Shopee,tekstur cair warna rada keruh bau manismeresapnya cepat lengket efek rasai bulan pemakaianjerawat muncul kontrol muncul jerawat gede sakit alih doi inidengan berat hati doi simpan dikulkaskarena botol lihat kayak seratserat dasar botol bintikbintik coklatnyapernah share fees fd dasar lampir dm somethinc dengan masalahtidak kualitas berubahhanya masuk kulkas pakai kocok monmaap lupa share kulit doi ku pakai bau pekat banget kayak bau manis madu benerbener pekat susah deskripsi ngalamin muncul jerawat muncul diaada pipi tulis jerawat kempes alas pakai tinggal empat lagiaku ambil resiko,4,Positive,tekstur cair warna rada keruh bau manismeresapnya cepat lengket efek rasai pemakaianjerawat muncul kontrol muncul jerawat gede sakit alih doi inidengan berat hati doi simpan dikulkaskarena botol seratserat dasar botol bintikbintik coklatnyapernah share fees fd dasar lampir dm somethinc masalahtidak kualitas berubahhanya masuk kulkas kocok monmaap lupa share kulit doi bau pekat bau manis madu benerbener pekat susah deskripsi ngalamin muncul jerawat muncul diaada pipi tulis jerawat kempes alas tinggal lagiaku ambil resiko
"Combination, Medium Light, Cool",Usage Period : 1 week - 1 monthPurchase Point : Shopee,bagus banget benerin tekstur kulit pas awalawal pakai purging minggu area dahi dagu jerawat hilang tekstur kulit baik pakai malemnya pagi muka halus kayak repurchase habis,4,Positive,bagus benerin tekstur kulit pas awalawal purging minggu area dahi dagu jerawat hilang tekstur kulit malemnya pagi muka halus repurchase habis
"Combination, Light, Warm",Usage Period : 6 months - 1 yearPurchase Point : Shopee,salah produk holy grail dapetinnya susah banget kayak hunger games packingnya aman travel friendly tekstur cair cepat resap kulit hasil rasa pakai botol ku asa banget efek kulit sehat kenyal glowing oh ya pakai produk malam tidur biar kering pakai toner ngelembabin telah pakai masker moisturizer melembabkan pas bangun pagi asa banget muka kenyal glowing pokok cinta banget produk,5,Positive,salah holy grail dapetinnya susah hunger games packingnya aman travel friendly tekstur cair cepat resap kulit hasil botol asa efek kulit sehat kenyal glowing oh malam tidur biar kering toner ngelembabin masker moisturizer melembabkan pas bangun pagi asa muka kenyal glowing cinta
"Normal, Medium, Warm",Usage Period : 1 week - 1 monthPurchase Point : Tokopedia,pakai retinol serum somethinc kulit mild asa kencang retinolnya bikin kering selang seling pakenya cinta hasil baik banget tekstur kulit ku bekas jerawat pih ku lumayan kurang sok happy oh ya warna hijau ungu packagingnya gemas banget,4,Positive,retinol serum somethinc kulit mild asa kencang retinolnya kering selang seling pakenya cinta hasil tekstur kulit bekas jerawat pih lumayan sok happy oh warna hijau ungu packagingnya gemas
"Combination, Medium Light, Neutral",Usage Period : 1 month - 3 monthsPurchase Point : Shopee,retinol lokal votre peau suka hasil suka somethinc giur mbak deszel repurchase serum pengin coba beli produk somethinc kemas dus botol serum bungkus wrap plastik kandung encapsulated retinol guna rasa efek retinol kuat perlahan cair serum warna kuning tekstur encer persis air cepat resap aplikasi rampung hidrasi kulit eye cream serum efek rasa bantu pulih jerawat bikin tekstur kulit bagusaan banget tampil poripori kecil bekas jerawat cepat pudar  alami purging parah kali pakai serum alami bo maskne parah purgingnya lumayan minggu muncul jerawat sakit  purging hasil bagus  pakai serum oh ya serum retinol bikin drying lumayan kencang pasti step hidrasi supple imbang efek dryingnya,5,Positive,retinol lokal votre peau suka hasil suka somethinc giur mbak deszel repurchase serum pengin coba beli somethinc kemas dus botol serum bungkus wrap plastik kandung encapsulated retinol efek retinol kuat perlahan cair serum warna kuning tekstur encer persis air cepat resap aplikasi rampung hidrasi kulit eye cream serum efek bantu pulih jerawat tekstur kulit bagusaan tampil poripori bekas jerawat cepat pudar alami purging parah serum alami bo maskne parah purgingnya lumayan minggu muncul jerawat sakit purging hasil bagus serum oh serum retinol drying lumayan kencang step hidrasi supple imbang efek dryingnya
"Oily, Medium, Neutral",Usage Period : 3 months - 6 monthsPurchase Point : Shopee,packaging kaca warna hijau pipet sok far good ambil produknyakonsistensi cair warna kuning muda gampang oksidasi simpan lemari aroma ganggu kalo ubah warna aroma rada strongreviewno purgingkayaknya retinol ter gentle coba efek purgingbangun pagi muka langsung lembutt perhati jerawatkuu tumbuh terkontroluntuk bekas jerawat notice perlahan pudar dukung skincare yaaku pakai minggu tingkatin kali minggu deh malam pakai somethinc kalo exfo pakai retinol yaaaaminusnya retinol susah banget dapatin kudu rebut gampang oksidasi sih kalo ubah warna efek negatif siii,4,Positive,packaging kaca warna hijau pipet sok far good ambil produknyakonsistensi cair warna kuning muda gampang oksidasi simpan lemari aroma ganggu kalo ubah warna aroma rada strongreviewno purgingkayaknya retinol ter gentle coba efek purgingbangun pagi muka langsung lembutt perhati jerawatkuu tumbuh terkontroluntuk bekas jerawat notice perlahan pudar dukung yaaku minggu tingkatin minggu malam somethinc kalo exfo retinol yaaaaminusnya retinol susah dapatin kudu rebut gampang oksidasi sih kalo ubah warna efek negatif siii
"Combination, Medium Light, Warm",Usage Period : 1 week - 1 monthPurchase Point : Shopee,tuh ragu sih pakai takut bikin break muka sensitif suka banget serum tekstur tuh cair warna coklat bau sengat sih bau serum bikin tekstur muka baik sih bekas jerawat pudar jerawat cepat kempes muka cerah pakai hilang milia retinol hilang milia ya pakai sih langsung hilang milianya rutin makenya hehe,5,Positive,tuh ragu sih takut break muka sensitif suka serum tekstur tuh cair warna coklat bau sengat sih bau serum tekstur muka sih bekas jerawat pudar jerawat cepat kempes muka cerah hilang milia retinol hilang milia sih langsung hilang milianya rutin makenya hehe
"Combination, Medium Light, Neutral",Usage Period : 3 months - 6 monthsPurchase Point : Instagram,takut pakai produk kandung retinol kesan keras wajah sensitif pakai nya gue rasai hasil banget kalo gue pakenya minggu kali totol daerah butuh bekas jerawat mata hasil maksimal pakai muka oh iya lupa pakai sun screen pagi kalo pas malam pakai,5,Positive,takut kandung retinol kesan keras wajah sensitif nya gue rasai hasil kalo gue pakenya minggu totol daerah butuh bekas jerawat mata hasil maksimal muka oh iya lupa sun screen pagi kalo pas malam
"Combination, Medium Light, Neutral",Usage Period : Less than 1 weekPurchase Point : Shopee,sold out aku kali pakai hubung umur masuk takut nerusinnya lanjut somethinc b hyaluron kalo minat dm instagram ya hihi natasyaslsb,5,Positive,sold out hubung umur masuk takut nerusinnya somethinc b hyaluron kalo minat dm instagram hihi natasyaslsb
"Combination, Medium, Warm",Usage Period : 1 week - 1 monthPurchase Point : Official Brand Store,preloved isi beli tanggal oktober simpan kulkas ya pakai ganti skincare regime sayang kalo dianggurin ribu free ongkir sejadetabek ya dm ig kartikaamd,5,Positive,preloved isi beli tanggal oktober simpan kulkas ganti regime sayang kalo dianggurin ribu free ongkir sejadetabek dm ig kartikaamd
"Oily, Medium, Neutral",Usage Period : Less than 1 weekPurchase Point : Shopee,sold pakai segel tau pakai underaged lanjur beli claimnya bagus banget pengin hilang bekas jerawat tt minat dm randjun,5,Positive,sold segel tau underaged lanjur beli claimnya bagus pengin hilang bekas jerawat tt minat dm randjun
"Combination, Medium, Warm",Usage Period : 3 months - 6 monthsPurchase Point : Shopee,retinol pertama langsung keranjingan bagus banget untung purging doi bikin jerawat cepat mateng muka asa plumpy cerah bagus deh pokok kalo duet serum serum aha nya avoskin weeeew bangun muka glowing banget beb asli kakak muji muka wkwkwk senank,5,Positive,retinol langsung keranjingan bagus untung purging doi jerawat cepat mateng muka asa plumpy cerah bagus kalo duet serum serum aha nya avoskin weeeew bangun muka glowing beb asli kakak muji muka wkwkwk senank
"Combination, Medium Light, Neutral",Usage Period : 1 month - 3 monthsPurchase Point : Shopee,retinol bilang presentase aman texturenya cair banget bau khusus sok far pakai jerawat ku baik hyperpigmentation ku kurang overall bagus banget harga affordable,5,Positive,retinol bilang presentase aman texturenya cair bau khusus sok far jerawat hyperpigmentation overall bagus harga affordable
"Oily, Medium Dark, Neutral",Usage Period : 1 month - 3 monthsPurchase Point : Shopee,pakai retinol kali nyantol somethinc minggu pakai kali minggu rencana minggu tiga besok dinaikin kali efek negatif tau efek jerawat cepat matang cepat kempes pakai bareng tamanu oil minggu pakai serum manfaat cerah produk banget sih dark spot pih pelanpelan banget pudar aneh pakai retinol kulit kering  kulit lewat minyak ohya pakai jauh selang hari ahabha deket,5,Positive,retinol nyantol somethinc minggu minggu rencana minggu besok dinaikin efek negatif tau efek jerawat cepat matang cepat kempes bareng tamanu oil minggu serum manfaat cerah sih dark spot pih pelanpelan pudar aneh retinol kulit kering kulit minyak ohya selang ahabha deket
"Oily, Medium Light, Neutral",Usage Period : 3 months - 6 monthsPurchase Point : Shopee,produk retinol lokal ciamik banget harga affordable gue pakai gentle banget gue pakai bawah eye gue bau nya bau kimia banget kayak retinol gue suka ceramide ingredient nya bagus skin barrier anti aging hasil nya bagus fine line eye gue pudar banget garis halus smile les pudar gue pakai selang seling copper peptide gue kasih bintang super cepat banget okaidasi nya ubah warna coklat warna bening kuning pas beli gue simpan tas tutup rapat kena sinar matahari cepat banget oksidasi nya gue coba simpan kulkas kalo worth pakai share orang biar habis nya botol nya bikin warna gelap kayak slow proses oksidasi nya sedia kemas ml bikin sistem pump keluar nya terus kena udara pas buka bikin cepat oksidasi nya oh ya guys pakai sure beli produk nya expiry date depan beli expiry date oksidasi sok iya oksidasi biggest issue banget produk super suka hasil nya,3,Neutral,retinol lokal ciamik harga affordable gue gentle gue eye gue bau nya bau kimia retinol gue suka ceramide ingredient nya bagus skin barrier anti aging hasil nya bagus fine line eye gue pudar garis halus smile les pudar gue selang seling copper peptide gue kasih bintang super cepat okaidasi nya ubah warna coklat warna bening kuning pas beli gue simpan tas tutup rapat kena sinar matahari cepat oksidasi nya gue coba simpan kulkas kalo worth share orang biar habis nya botol nya warna gelap slow proses oksidasi nya sedia kemas ml sistem pump nya kena udara pas buka cepat oksidasi nya oh guys sure beli nya expiry date beli expiry date oksidasi sok iya oksidasi biggest issue super suka hasil nya
"Combination, Dark, Neutral",Usage Period : 6 months - 1 yearPurchase Point : FD Flash Sale,takut breakout alergi kalo ganti serum bod shp kulit sensitif turns sok gewd kulit cerah lembab warna kulit muka rata sesuai klaim guna bahan retinolnya affordable kemas mudah bawa tekstur cair sok thick cepat resap muka terluvv definitely repurchase,4,Positive,takut breakout alergi kalo ganti serum bod shp kulit sensitif turns sok gewd kulit cerah lembab warna kulit muka sesuai klaim bahan retinolnya affordable kemas mudah bawa tekstur cair sok thick cepat resap muka terluvv definitely repurchase
"Oily, Medium Light, Warm",Usage Period : Less than 1 weekPurchase Point : JD.id,olshop sold  id stok hihihihi  auto pesan dunks coba besok malam minggu sih bekas jerawat jerawat bulan atur pakai nya senin rabu jumat khasiat  manjur banget bekas jerawat pipi dahi samar hitam banget dempul foundation tutup bekas jerawat butuh bulan rasa khasiat hihi bebas pakai cushion  bekas jerawat item samar hihihi,5,Positive,olshop sold id stok hihihihi auto pesan dunks coba besok malam minggu sih bekas jerawat jerawat atur nya senin rabu jumat khasiat manjur bekas jerawat pipi dahi samar hitam dempul foundation tutup bekas jerawat butuh khasiat hihi bebas cushion bekas jerawat item samar hihihi
